category,prod_name,prod_price,product_picture,run_date
Vodka,GORDON-S THE ORIGINAL LONDON DRY GIN 750 ML,GS.  45.000,https://www.superseis.com.py/images/thumbs/0246963_500.png,27/12/23
Vodka,GORDON-S SICILIAN LEMON DISTILLED GIN 700 ML,GS.  64.800,https://www.superseis.com.py/images/thumbs/0246962_500.png,27/12/23
Vodka,MIKE-S HARD LEMONADE BEBIDA ALCOHOLICA 269 ML,GS.  5.000,https://www.superseis.com.py/images/thumbs/0246250_500.jpeg,27/12/23
Vodka,GIN PINK BEEFEATER 750ML,GS.  105.000,https://www.superseis.com.py/images/thumbs/0243819_500.jpeg,27/12/23
Vodka,VODKA BLUE ABSOLUT 750ML,GS.  113.500,https://www.superseis.com.py/images/thumbs/0243818_500.jpeg,27/12/23
Vodka,VODKA VAINILLA ABSOLUT 750ML,GS.  130.900,https://www.superseis.com.py/images/thumbs/0243817_500.jpeg,27/12/23
Vodka,VODKA  CITRON ABSOLUT 750ML ,GS.  130.900,https://www.superseis.com.py/images/thumbs/0243814_500.jpeg,27/12/23
Vodka,ABSOLUT PACK VODKA 750 ML + ABSOLUT CITRON 750 ML,GS.  170.000,https://www.superseis.com.py/images/thumbs/0243058_500.jpeg,27/12/23
Vodka,GIN PREMIUM BLACK 700ML PUERTO DE INDIAS,GS.  164.000,https://www.superseis.com.py/images/thumbs/0242495_500.jpeg,27/12/23
Vodka,SERNOVA VODKA ITALIAN STYLE FRESH CITRUS 700 ML,GS.  56.050,https://www.superseis.com.py/images/thumbs/0241598_500.jpeg,27/12/23
Vodka,SERNOVA VODKA ITALIAN STYLE WILD BERRIES 700 ML,GS.  56.050,https://www.superseis.com.py/images/thumbs/0241597_500.jpeg,27/12/23
Vodka,SERNOVA VODKA ITALIAN STYLE 700 ML,GS.  46.800,https://www.superseis.com.py/images/thumbs/0241596_500.jpeg,27/12/23
Vodka,WHITLEY NEILL GIN LEMONGRASS & GINGER 700 ML,GS.  200.000,https://www.superseis.com.py/images/thumbs/0241326_500.jpeg,27/12/23
Vodka,WHITLEY NEILL PACK GIN RHUBARB & GINGER 700 ML + COPA,GS.  200.000,https://www.superseis.com.py/images/thumbs/0241323_500.jpeg,27/12/23
Vodka,CITY OF LONDON GIN MURCIAN ORANGE 700 ML,GS.  110.000,https://www.superseis.com.py/images/thumbs/0241318_500.jpeg,27/12/23
Sal,SAL MARINA ENTREFINA YODADA GARZA 500GR,GS.  22.700,https://www.superseis.com.py/images/thumbs/0252043_500.jpeg,27/12/23
Sal,SAL D/HIMALAYA COND FINA CAF EXPR OM 400,GS.  37.000,https://www.superseis.com.py/images/thumbs/0250478_500.jpeg,27/12/23
Sal,OM SAL DEL HIMALAYA CONDIMENTADA FINA MANGO Y CURCUMA 400 GR,GS.  37.000,https://www.superseis.com.py/images/thumbs/0250477_500.jpeg,27/12/23
Sal,OM SAL DEL HIMALAYA CONDIMENTADA FINA CACAO Y PIMIENTA 400 GR,GS.  37.000,https://www.superseis.com.py/images/thumbs/0250476_500.jpeg,27/12/23
Sal,SAL D/HIMALAYA COND FINA PROVEN OM 400GR,GS.  37.000,https://www.superseis.com.py/images/thumbs/0250475_500.jpeg,27/12/23
Sal,OM SAL DEL HIMALAYA CONDIMENTADA FINA YERBA MATE 400 GR,GS.  37.000,https://www.superseis.com.py/images/thumbs/0250474_500.jpeg,27/12/23
Sal,OM SAL DEL HIMALAYA CONDIMENTADA GRUESA PROVENZAL 400 GR,GS.  37.000,https://www.superseis.com.py/images/thumbs/0250473_500.jpeg,27/12/23
Sal,OM SAL DEL HIMALAYA CONDIMENTADA GRUESA CACAO Y PIMIENTA 400 GR,GS.  37.000,https://www.superseis.com.py/images/thumbs/0250472_500.jpeg,27/12/23
Sal,OM SAL DEL HIMALAYA CONDIMENTADA GRUESA CAFE EXPRESO 400 GR,GS.  37.000,https://www.superseis.com.py/images/thumbs/0250471_500.jpeg,27/12/23
Sal,SAL MARINA FINA YODADA GARZA 500GR,GS.  22.700,https://www.superseis.com.py/images/thumbs/0250248_500.jpeg,27/12/23
Sal,SAL CONDIMENTADA PRIMICIA *800GR,GS.  6.500,https://www.superseis.com.py/images/thumbs/0250148_500.jpeg,27/12/23
Sal,MCCORMICK SAL CON AJO 60 GR,GS.  9.700,https://www.superseis.com.py/images/thumbs/0249985_500.jpeg,27/12/23
Sal,MCCORMICK SAL MARINA CON FINAS HIERBAS 475 GR,GS.  41.300,https://www.superseis.com.py/images/thumbs/0249980_500.jpeg,27/12/23
Sal,OM SAL DEL HIMALAYA CONDIMENTADA FINA FRAMBUESA 400 GR,GS.  37.000,https://www.superseis.com.py/images/thumbs/0249961_500.jpeg,27/12/23
Sal,PRIMICIA SAL MARINA FINA YODADA 500 GR,GS.  4.550,https://www.superseis.com.py/images/thumbs/0248790_500.jpeg,27/12/23
Sal,SAL ROSA DEL HIMALAYA FINA ZAELI 250GR,GS.  7.350,https://www.superseis.com.py/images/thumbs/0248003_500.jpeg,27/12/23
Sal,OM SAL DEL HIMALAYA CONDIMENTADA GRUESA FRAMBUESA 400 GR,GS.  37.000,https://www.superseis.com.py/images/thumbs/0247687_500.jpeg,27/12/23
Sal,SAL DE MAR GRUESA NUTRISAL 1KG,GS.  9.500,https://www.superseis.com.py/images/thumbs/0245885_500.jpeg,27/12/23
Sal,SAL DE MAR ENTREFINA NUTRISAL 1KG,GS.  9.500,https://www.superseis.com.py/images/thumbs/0245884_500.jpeg,27/12/23
Sal,SAL DE MAR FINA NUTRISAL 1KG,GS.  9.500,https://www.superseis.com.py/images/thumbs/0245883_500.jpeg,27/12/23
Sal,SAL ENTREFINA YODADA BIANCA 1KL,GS.  4.500,https://www.superseis.com.py/images/thumbs/0243732_500.jpeg,27/12/23
Sal,SAL FINA YODADA BIANCA 1KL,GS.  4.100,https://www.superseis.com.py/images/thumbs/0243731_500.jpeg,27/12/23
Sal,SAL ENTREFINA YODADA BIANCA 500GR,GS.  2.300,https://www.superseis.com.py/images/thumbs/0243730_500.jpeg,27/12/23
Sal,SAL FINA YODADA BIANCA 500GR,GS.  2.100,https://www.superseis.com.py/images/thumbs/0243729_500.jpeg,27/12/23
Sal,SAL GRUESA DEL HIMALAYA LA VICTORIA 450GR,GS.  59.800,https://www.superseis.com.py/images/thumbs/0243510_500.jpeg,27/12/23
Sal,SAL FINA DEL HIMALAYA LA VICTORIA 500GR,GS.  59.800,https://www.superseis.com.py/images/thumbs/0243509_500.jpeg,27/12/23
Sal,CARMENCITA 100 A?OS MOLINILLO SAL MARINA CON AZAFRAN 110 GR,GS.  42.000,https://www.superseis.com.py/images/thumbs/0242476_500.jpeg,27/12/23
Sal,CARMENCITA 100 A?OS MOLINILLO SAL MARINA Y TRUFA 112 GR,GS.  42.000,https://www.superseis.com.py/images/thumbs/0242468_500.jpeg,27/12/23
Sal,CELUSAL DELI GRILL SAL CON HIERBAS Y ESPECIAS 230 GR,GS.  18.250,https://www.superseis.com.py/images/thumbs/0241579_500.jpeg,27/12/23
Sal,CELUSAL DELI CRIOLLO SAL CON ESPECIAS 230 GR,GS.  18.250,https://www.superseis.com.py/images/thumbs/0241578_500.jpeg,27/12/23
Turrones,ARCOR TURRON & MANI SABOR CHOCOLATADA 25 GR,GS.  1.000,https://www.superseis.com.py/images/thumbs/0250097_500.jpeg,27/12/23
Turrones,TURRON DE MANI CON MIEL 120GR LHERITIER PAQUETE ,GS.  4.650,https://www.superseis.com.py/images/thumbs/0250069_500.jpeg,27/12/23
Turrones,TURRON DE MANI CON MIEL 250 GR LHERITIER PAQUETE,GS.  8.400,https://www.superseis.com.py/images/thumbs/0250068_500.jpeg,27/12/23
Turrones,TURRON DE MANI CON FRUTAS 100 GR LHERITIER PLA,GS.  4.500,https://www.superseis.com.py/images/thumbs/0250067_500.jpeg,27/12/23
Turrones,PICO TURRON DE CHOCOLATE CON LECHE Y ALMENDRAS 200 GR,GS.  76.250,https://www.superseis.com.py/images/thumbs/0249206_500.jpeg,27/12/23
Turrones,PICO TURRON IMPERIAL DE ALICANTE 200 GR,GS.  69.750,https://www.superseis.com.py/images/thumbs/0249204_500.jpeg,27/12/23
Turrones,TURRON EL ALMENDRO BLANDO 75GR CJA,GS.  30.500,https://www.superseis.com.py/images/thumbs/0248249_500.jpeg,27/12/23
Turrones,TURRON EL ALMENDRO DURO X 150GR CJA ,GS.  57.000,https://www.superseis.com.py/images/thumbs/0247483_500.jpeg,27/12/23
Turrones,TURRON SABOR YOGU FRESA DELAVIUDA 200GR,GS.  54.000,https://www.superseis.com.py/images/thumbs/0246749_500.jpeg,27/12/23
Turrones,"TURRON DE ALICANTE, GUIRLACHE Y CHOCOLATE CON LECHE Y ALMENDRAS PICO 550GR",GS.  172.000,https://www.superseis.com.py/images/thumbs/0240370_500.jpeg,27/12/23
Turrones,TURRON DE CHOCOLATE CRUJIENTE PICO 200GR,GS.  27.600,https://www.superseis.com.py/images/thumbs/0240369_500.jpeg,27/12/23
Turrones,TURRON DE ALICANTE PICO 150GR,GS.  45.200,https://www.superseis.com.py/images/thumbs/0240368_500.jpeg,27/12/23
Turrones,TURRON DE JIJONA PICO 150GR,GS.  45.200,https://www.superseis.com.py/images/thumbs/0240367_500.jpeg,27/12/23
Turrones,TORTA TURRON DE ALICANTE PICO 200GR,GS.  61.200,https://www.superseis.com.py/images/thumbs/0240364_500.jpeg,27/12/23
Turrones,TURRON DE CHOCOLATE Y ALMENDRAS CORTE INGLES 250GR,GS.  59.000,https://www.superseis.com.py/images/thumbs/0239720_500.jpeg,27/12/23
Turrones,GEORGALOS TURRON DE MANI NAMUR 25 GR,GS.  1.200,https://www.superseis.com.py/images/thumbs/0229972_500.jpeg,27/12/23
Turrones,OBLEA TURRON RELL. PASTA MANI 50X25G.,GS.  1.050,https://www.superseis.com.py/images/thumbs/0229916_500.jpeg,27/12/23
Turrones,TURRON DE MANI ARCOR BAR 50 GR,GS.  1.000,https://www.superseis.com.py/images/thumbs/0226402_500.jpeg,27/12/23
Turrones,TURRON DE MANI 125GR KELWA BSA,GS.  6.550,https://www.superseis.com.py/images/thumbs/0222150_500.jpeg,27/12/23
Turrones,TURRON DE MANI 31GR KELWA BSA,GS.  2.050,https://www.superseis.com.py/images/thumbs/0221625_500.jpeg,27/12/23
Turrones,TURRON DE MANI 65GR KELWA BSA,GS.  3.400,https://www.superseis.com.py/images/thumbs/0220890_500.jpeg,27/12/23
Turrones,TURRON DE MANI CON MIEL 80GR LHERITIER PAQUETE ,GS.  3.600,https://www.superseis.com.py/images/thumbs/0218330_500.jpeg,27/12/23
Turrones,TURRON DE LA VIUDA BLANDO X 150GR CJA ,GS.  65.000,https://www.superseis.com.py/images/thumbs/0212161_500.jpeg,27/12/23
Turrones,TURRON EL ALMENDRO BLANDO X 150GR CJA ,GS.  57.000,https://www.superseis.com.py/images/thumbs/0212153_500.jpeg,27/12/23
Turrones,TURRON GEORGALOS DE MANI CON CHOCOLATE 120 GR,GS.  6.300,https://www.superseis.com.py/images/thumbs/0200925_500.jpeg,27/12/23
Turrones,TURRON DE MANI CON FRUTAS,GS.  7.500,https://www.superseis.com.py/images/thumbs/0200136_500.jpeg,27/12/23
Turrones,TURRON DE MANI Y ALMENDRAS GEORGALOS 80 GR,GS.  7.100,https://www.superseis.com.py/images/thumbs/0200135_500.jpeg,27/12/23
Vidrio,MANIJA C/FRASE 510ML DAYO REF ZB01300,GS.  10.900,https://www.superseis.com.py/images/thumbs/0253293_500.png,27/12/23
Vidrio,MANIJA C/FRASE 385ML DAYO REF ZB11300,GS.  14.900,https://www.superseis.com.py/images/thumbs/0253222_500.png,27/12/23
Vidrio,VASOS SAN MARINO DE 270ML DE 6UN SET,GS.  23.900,https://www.superseis.com.py/images/thumbs/0253189_500.jpeg,27/12/23
Vidrio,VASOS SAN MARINO DE 270ML DE 6UN SET,GS.  23.900,https://www.superseis.com.py/images/thumbs/0253155_500.jpeg,27/12/23
Vidrio,VASO SAN MARINO ARUBA 465 ML,GS.  9.900,https://www.superseis.com.py/images/thumbs/0253154_500.jpeg,27/12/23
Vidrio,VASOS SAN MARINO MANC DE 310ML DE 6UN SE,GS.  42.900,https://www.superseis.com.py/images/thumbs/0253153_500.jpeg,27/12/23
Vidrio,VASO SAN MARINO BROOKLYN 200 ML,GS.  6.900,https://www.superseis.com.py/images/thumbs/0253152_500.jpeg,27/12/23
Vidrio,VASO SAN MARINO BROOKLYN 65 ML,GS.  6.500,https://www.superseis.com.py/images/thumbs/0253151_500.jpeg,27/12/23
Vidrio,VASO SAN MARINO FIRENZE 360 ML,GS.  5.900,https://www.superseis.com.py/images/thumbs/0253150_500.jpeg,27/12/23
Vidrio,MANIJA P/CERV VIDRIO 360ML DAYO ZB06 300,GS.  14.900,https://www.superseis.com.py/images/thumbs/0253133_500.jpeg,27/12/23
Vidrio,COPA P/HELADO 190ML VD DAYO REF BQ9575,GS.  5.900,https://www.superseis.com.py/images/thumbs/0253036_500.jpeg,27/12/23
Vidrio,COPA D/VIDRIO P/VINO 408ML DAYO 11SJ3314,GS.  18.900,https://www.superseis.com.py/images/thumbs/0253035_500.jpeg,27/12/23
Vidrio,COZA SERVILLETERO REDONDO DE PLASTICO AZUL BALTICO,GS.  9.400,https://www.superseis.com.py/images/thumbs/0248043_500.jpeg,27/12/23
Vidrio,SM BUFFET COPAS DE 186 ML 6 UNIDADES,GS.  54.000,https://www.superseis.com.py/images/thumbs/0246093_500.jpeg,27/12/23
Vidrio,VASO CON TAPA 580ML DIS MINNIE PLASUTIL SIN E REF 6901,GS.  29.600,https://www.superseis.com.py/images/thumbs/0242262_500.jpeg,27/12/23
Vidrio,VASO LAGER SM 300ML,GS.  5.900,https://www.superseis.com.py/images/thumbs/0239398_500.jpeg,27/12/23
Vidrio,COZA VASO DE PLASTICO ROJO 275 ML,GS.  6.500,https://www.superseis.com.py/images/thumbs/0238108_500.jpeg,27/12/23
Vidrio,COZA SERVILLETERO REDONDO DE PLASTICO COZY NEGRO,GS.  9.400,https://www.superseis.com.py/images/thumbs/0238107_500.jpeg,27/12/23
Vidrio,COZA VASO CONICO CASUAL BLANCO 200 ML,GS.  4.900,https://www.superseis.com.py/images/thumbs/0238106_500.jpeg,27/12/23
Vidrio,COZA VASO CONICO CASUAL ROJO 200 ML,GS.  4.900,https://www.superseis.com.py/images/thumbs/0238104_500.jpeg,27/12/23
Vidrio,COZA VASO CONICO CASUAL NEGRO 200 ML,GS.  4.900,https://www.superseis.com.py/images/thumbs/0238103_500.jpeg,27/12/23
Vidrio,COZA VASO DE PLASTICO NEGRO 275 ML,GS.  6.500,https://www.superseis.com.py/images/thumbs/0238095_500.jpeg,27/12/23
Vidrio,COZA VASO CONICO CASUAL AZUL BALTICO 200 ML,GS.  4.900,https://www.superseis.com.py/images/thumbs/0238091_500.jpeg,27/12/23
Vidrio,COZA VASO DE PLASTICO AZUL BALTICO 275 ML,GS.  6.500,https://www.superseis.com.py/images/thumbs/0238090_500.jpeg,27/12/23
Vidrio,COZA VASO DE PLASTICO BLANCO 275 ML,GS.  6.500,https://www.superseis.com.py/images/thumbs/0238089_500.jpeg,27/12/23
Vidrio,COPA P/AGUA OXFORD CRYSTAL 490 ML REF.7220 ,GS.  32.900,https://www.superseis.com.py/images/thumbs/0237939_500.jpeg,27/12/23
Vidrio,CHAMPAÑERA INOX QIANLI DE 5LIT,GS.  44.900,https://www.superseis.com.py/images/thumbs/0235871_500.jpeg,27/12/23
Fideo/Arroz,FIDEO INTEGRAL FUSILLI BARILLA 500GR,GS.  33.000,https://www.superseis.com.py/images/thumbs/0240827_500.jpeg,27/12/23
Fideo/Arroz,FIDEOS TALLARIN CASERO INTEGRAL 250GR HILDEBRAND CJA ,GS.  5.000,https://www.superseis.com.py/images/thumbs/0224801_500.png,27/12/23
Fideo/Arroz,FIDEOS PENNE 250GR SCHAR PAQUETE ,GS.  24.000,https://www.superseis.com.py/images/thumbs/0216495_500.jpeg,27/12/23
Fideo/Arroz,FIDEO RENATA INT.SPAGUET 8,GS.  12.250,https://www.superseis.com.py/images/thumbs/0208596_500.jpeg,27/12/23
Fideo/Arroz,ARROZ CHINES INTEGRAL BOLSA 1KG,GS.  17.800,https://www.superseis.com.py/images/thumbs/0196245_500.jpeg,27/12/23
Fideo/Arroz,FIDEO RENATA INT.FUSILLI,GS.  12.250,https://www.superseis.com.py/images/thumbs/0194417_500.jpeg,27/12/23
Fideo/Arroz,ARROZ TIO JOAO INTEGRAL 500 GR.,GS.  7.200,https://www.superseis.com.py/images/thumbs/0193877_500.jpeg,27/12/23
Fideo/Arroz,ARROZ TIO JOAO INTEGRAL 1KG,GS.  14.400,https://www.superseis.com.py/images/thumbs/0193875_500.jpeg,27/12/23
Leche en Polvo/varios,LECHE ENTERA E/POLVO LA SERENISIMA 400GR,GS.  34.800,https://www.superseis.com.py/images/thumbs/0252697_500.jpeg,27/12/23
Leche en Polvo/varios,PARMALAT LECHE CONDENSADA 395 GR,GS.  10.900,https://www.superseis.com.py/images/thumbs/0250274_500.jpeg,27/12/23
Leche en Polvo/varios,LA SERENISIMA LECHE ENTERA EN POLVO ZERO LACTOSA 400 GR,GS.  40.000,https://www.superseis.com.py/images/thumbs/0250053_500.jpeg,27/12/23
Leche en Polvo/varios,NESTLE MOCA LECHE CONDENSADA CERO LACTOSA 395 GR,GS.  16.800,https://www.superseis.com.py/images/thumbs/0249588_500.jpeg,27/12/23
Leche en Polvo/varios,NIDO LECHE EN POLVO ETAPA 3 APARTIR DE 1 A?O 800 GR,GS.  69.500,https://www.superseis.com.py/images/thumbs/0249217_500.jpeg,27/12/23
Leche en Polvo/varios,LECHE CONDENSADA 395GR MOCA PACK,GS.  28.300,https://www.superseis.com.py/images/thumbs/0244911_500.jpeg,27/12/23
Leche en Polvo/varios,LECHE CONDENSADA NORTE 395GR,GS.  11.900,https://www.superseis.com.py/images/thumbs/0242901_500.jpeg,27/12/23
Leche en Polvo/varios,LECHE CONDENSADA TRADICIONAL NORTE 395GR,GS.  12.900,https://www.superseis.com.py/images/thumbs/0242868_500.jpeg,27/12/23
Leche en Polvo/varios,LECHE CONDENSADA 395GR MOCA TET,GS.  14.500,https://www.superseis.com.py/images/thumbs/0229133_500.jpeg,27/12/23
Leche en Polvo/varios,LECHE DESCREMADA INSTANTANEA EN POLVO 400GR TREBOL BSA,GS.  28.150,https://www.superseis.com.py/images/thumbs/0228862_500.jpeg,27/12/23
Leche en Polvo/varios,LECHE ENTERA INSTANTANEA EN POLVO 400GR TREBOL BSA,GS.  28.150,https://www.superseis.com.py/images/thumbs/0228771_500.jpeg,27/12/23
Leche en Polvo/varios,LECHE ENTERA E/POLVO LA SERENISIMA 400GR CJA,GS.  34.800,https://www.superseis.com.py/images/thumbs/0226412_500.jpeg,27/12/23
Leche en Polvo/varios,LECHE CONDENSADA 1KG SUN LAT,GS.  25.900,https://www.superseis.com.py/images/thumbs/0221649_500.jpeg,27/12/23
Leche en Polvo/varios,LECHE ENTERA INSTANTANEA EN POLVO 800GR TREBOL BSA,GS.  48.150,https://www.superseis.com.py/images/thumbs/0214694_500.jpeg,27/12/23
Leche en Polvo/varios,LECHE EN POLVO 800GR SANCOR CAJA,GS.  75.700,https://www.superseis.com.py/images/thumbs/0214659_500.jpeg,27/12/23
Leche en Polvo/varios,LECHE EN POLVO DESCREMADA INSTANTANEA SANCOR 30 STICKS X 5GR CAJA 150GR   ,GS.  26.400,https://www.superseis.com.py/images/thumbs/0214003_500.png,27/12/23
Leche en Polvo/varios,LECHE CONDENSADA 395GR PRIMICIA LATA,GS.  14.400,https://www.superseis.com.py/images/thumbs/0212285_500.jpeg,27/12/23
Leche en Polvo/varios,LECHE EN POLVO 400GR LACTOLANDA ENTERA PAQUETE ,GS.  27.100,https://www.superseis.com.py/images/thumbs/0207035_500.png,27/12/23
Leche en Polvo/varios,LECHE EN POLVO 800GR LACTOLANDA ENTERA PAQUETE ,GS.  46.450,https://www.superseis.com.py/images/thumbs/0207033_500.png,27/12/23
Leche en Polvo/varios,LECHE EN POLVO ENTERA EL TERN,GS.  50.000,https://www.superseis.com.py/images/thumbs/0200505_500.jpeg,27/12/23
Leche en Polvo/varios,OLVEBRA SOYMILKE CONDENSADA DE SOYA X 320 GR X 24,GS.  24.550,https://www.superseis.com.py/images/thumbs/0194792_500.jpeg,27/12/23
Leche en Polvo/varios,LECHE EN POLVO ILOLAY ENTERA PAQUETE 200 GR,GS.  17.300,https://www.superseis.com.py/images/thumbs/0176771_500.jpeg,27/12/23
Leche en Polvo/varios,LECHE ENTERA EN POLVO ILOLAY C,GS.  32.700,https://www.superseis.com.py/images/thumbs/0176770_500.jpeg,27/12/23
Accesorios Cabello,CEPILLO P/CABELLO REVLON PURPURA REF RV2832LADI BLIS,GS.  44.750,https://www.superseis.com.py/images/thumbs/0251770_500.jpeg,27/12/23
Accesorios Cabello,CEPILLO P/CABELLO PLATEADO REVLON REF RV2828LADI BLIS,GS.  41.350,https://www.superseis.com.py/images/thumbs/0250516_500.jpeg,27/12/23
Accesorios Cabello,CEPILLO P/CABELLO REVLON ROJO REF RV2827LADI BLIS,GS.  48.600,https://www.superseis.com.py/images/thumbs/0250515_500.jpeg,27/12/23
Accesorios Cabello,CEPILLO P/CABELLO OVAL ESTAMPAS MODA CON,GS.  38.000,https://www.superseis.com.py/images/thumbs/0247886_500.jpeg,27/12/23
Accesorios Cabello,CEPILLO P/CABELLO HOT WHEELS CONDOR 1UN,GS.  57.050,https://www.superseis.com.py/images/thumbs/0247885_500.jpeg,27/12/23
Accesorios Cabello,CEPILLO P/CABELLO BARBIE CONDOR 1UN BLIS,GS.  72.350,https://www.superseis.com.py/images/thumbs/0247884_500.jpeg,27/12/23
Accesorios Cabello,CEPILLO BRUSH/RECT/PEINE SWEET CARE KIT,GS.  75.500,https://www.superseis.com.py/images/thumbs/0247764_500.jpeg,27/12/23
Accesorios Cabello,CEPILLO/PEINE/ESPEJO SWEET CARE KIT,GS.  75.500,https://www.superseis.com.py/images/thumbs/0247763_500.jpeg,27/12/23
Accesorios Cabello,GOMAS PARA CABELLO COLOR ROSADO SWEET CARE 10UNID,GS.  8.950,https://www.superseis.com.py/images/thumbs/0243617_500.jpeg,27/12/23
Accesorios Cabello,SET DE HEBILLAS CUADRADAS DE COLORES SWEET CARE 6UNID,GS.  18.700,https://www.superseis.com.py/images/thumbs/0243615_500.jpeg,27/12/23
Accesorios Cabello,SET DE HEBILLAS TRIANGULO DE COLORES SWEET CARE 6UNID,GS.  18.700,https://www.superseis.com.py/images/thumbs/0243614_500.jpeg,27/12/23
Accesorios Cabello,VINCHA PARA CABELLO COLOR ROJO SWEET CARE,GS.  24.700,https://www.superseis.com.py/images/thumbs/0243612_500.jpeg,27/12/23
Accesorios Cabello,VINCHA PARA CABELLO COLOR NUDE SWEET CARE,GS.  24.700,https://www.superseis.com.py/images/thumbs/0243611_500.jpeg,27/12/23
Accesorios Cabello,VINCHA PARA CABELLO COLOR NEGRO SWEET CARE,GS.  24.700,https://www.superseis.com.py/images/thumbs/0243610_500.jpeg,27/12/23
Accesorios Cabello,SET DE HEBILLAS SWEET CARE 4UNID,GS.  15.000,https://www.superseis.com.py/images/thumbs/0243609_500.jpeg,27/12/23
Accesorios Cabello,HEBILLA CUADRADA CON PERLAS DORADAS SWEET CARE,GS.  15.500,https://www.superseis.com.py/images/thumbs/0243608_500.jpeg,27/12/23
Accesorios Cabello,SET DE HEBILLAS CON PERLAS BLANCAS SWEET CARE 3UNID,GS.  16.100,https://www.superseis.com.py/images/thumbs/0243607_500.jpeg,27/12/23
Accesorios Cabello,GOMA PARA CABELLO COLOR NEGRO SWEET CARE 2UNID,GS.  6.700,https://www.superseis.com.py/images/thumbs/0235401_500.jpeg,27/12/23
Accesorios Cabello,GOMA PARA CABELLO COLOR BLANCO SWEET CARE 2UNID,GS.  6.700,https://www.superseis.com.py/images/thumbs/0235400_500.jpeg,27/12/23
Accesorios Cabello,GOMA PARA CABELLO COLOR NEGRO/ROJO SWEET CARE 2UNID,GS.  8.150,https://www.superseis.com.py/images/thumbs/0235399_500.jpeg,27/12/23
Accesorios Cabello,KIT PEINE RECTANGULAR + ESPEJO SWEET CARE,GS.  52.200,https://www.superseis.com.py/images/thumbs/0235398_500.jpeg,27/12/23
Accesorios Cabello,CEPILLO DE PELO CURVO SWEET CARE,GS.  30.800,https://www.superseis.com.py/images/thumbs/0235396_500.jpeg,27/12/23
Accesorios Cabello,CEPILLO DE PELO ANTI-FRIZZ SWEET CARE,GS.  38.000,https://www.superseis.com.py/images/thumbs/0235395_500.jpeg,27/12/23
Accesorios Cabello,CEPILLO DE PELO PARA BRUSHING SWEET CARE,GS.  38.000,https://www.superseis.com.py/images/thumbs/0235394_500.jpeg,27/12/23
Accesorios Cabello,GOMAS DE PELO GRUESA TONOS NARANJA SWEET CARE 6UNID,GS.  8.150,https://www.superseis.com.py/images/thumbs/0235393_500.jpeg,27/12/23
Accesorios Cabello,GOMAS DE PELO GRUESA TONOS ROSA SWEET CARE 6UNID,GS.  8.150,https://www.superseis.com.py/images/thumbs/0235392_500.jpeg,27/12/23
Accesorios Cabello,GOMAS DE PELO GRUESA TONOS AZULES SWEET CARE 6UNID,GS.  8.150,https://www.superseis.com.py/images/thumbs/0235391_500.jpeg,27/12/23
Aperitivos sin Alcohol,"AMARGO CITRUS TERMA 1,35LT",GS.  17.900,https://www.superseis.com.py/images/thumbs/0252852_500.jpeg,27/12/23
Aperitivos sin Alcohol,"AMARGO MANZANA CERO TERMA 1,35LT",GS.  17.900,https://www.superseis.com.py/images/thumbs/0252851_500.jpeg,27/12/23
Aperitivos sin Alcohol,"AMARGO PEPERINA & CORIANDRO TERMA 1,35LT",GS.  17.900,https://www.superseis.com.py/images/thumbs/0252850_500.jpeg,27/12/23
Aperitivos sin Alcohol,"AMARGO PATAGONICO TERMA 1,35LT",GS.  17.900,https://www.superseis.com.py/images/thumbs/0252849_500.jpeg,27/12/23
Aperitivos sin Alcohol,"AMARGO CUYANO CERO TERMA 1,35LT",GS.  17.900,https://www.superseis.com.py/images/thumbs/0252848_500.jpeg,27/12/23
Aperitivos sin Alcohol,"AMARGO CUYANO TERMA 1,35LT",GS.  17.900,https://www.superseis.com.py/images/thumbs/0252847_500.jpeg,27/12/23
Aperitivos sin Alcohol,"AMARGO SERRANO CERO TERMA 1,35LT",GS.  17.900,https://www.superseis.com.py/images/thumbs/0252846_500.jpeg,27/12/23
Aperitivos sin Alcohol,"AMARGO SERRANO TERMA 1,35LT",GS.  17.900,https://www.superseis.com.py/images/thumbs/0252845_500.jpeg,27/12/23
Aperitivos sin Alcohol,"AMARGO LIMON TERMA 1,35LT",GS.  17.900,https://www.superseis.com.py/images/thumbs/0252843_500.jpeg,27/12/23
Aperitivos sin Alcohol,"AMARGO POMELO ROSADO TERMA 1,75LT",GS.  22.200,https://www.superseis.com.py/images/thumbs/0252842_500.jpeg,27/12/23
Aperitivos sin Alcohol,"AMARGO SERRANO TERMA 1,75LT",GS.  22.200,https://www.superseis.com.py/images/thumbs/0252841_500.jpeg,27/12/23
Aperitivos sin Alcohol,SAINT PIERRE PINK LEMONADE 270 ML,GS.  5.900,https://www.superseis.com.py/images/thumbs/0246975_500.png,27/12/23
Aperitivos sin Alcohol,EASY BOOZE GINGER GIN 269 ML,GS.  6.400,https://www.superseis.com.py/images/thumbs/0246974_500.png,27/12/23
Aperitivos sin Alcohol,EASY BOOZE GIN TONIC 269 ML,GS.  6.400,https://www.superseis.com.py/images/thumbs/0246972_500.png,27/12/23
Aperitivos sin Alcohol,CERVEZA STELLA ARTOIS SIN ALCOHOL BOT 330CC STELLA ARTOIS x 24,GS.  7.000,https://www.superseis.com.py/images/thumbs/0241700_500.jpeg,27/12/23
Aperitivos sin Alcohol,"AMARGO POMELO TERMA 1,35LT",GS.  17.900,https://www.superseis.com.py/images/thumbs/0240930_500.jpeg,27/12/23
Aperitivos sin Alcohol,BEBIDA DIETETICA SERRANO SABOT 1500ML,GS.  16.500,https://www.superseis.com.py/images/thumbs/0235072_500.jpeg,27/12/23
Aperitivos sin Alcohol,BEBIDA DIETETICA SABOR POMELO SABOT 1500ML,GS.  16.500,https://www.superseis.com.py/images/thumbs/0235071_500.jpeg,27/12/23
Aperitivos sin Alcohol,BEBIDA DIETETICA SABOR LIMON SABOT 1500ML,GS.  16.500,https://www.superseis.com.py/images/thumbs/0235070_500.jpeg,27/12/23
Aperitivos sin Alcohol,BEBIDA DIETETICA SABOR CITRUS SABOT 1500ML,GS.  16.500,https://www.superseis.com.py/images/thumbs/0235068_500.jpeg,27/12/23
Tuberculos/ Raices,ZANAHORIA BABY X KG,GS.  115.400,https://www.superseis.com.py/images/thumbs/0251942_500.jpeg,28/12/23
Tuberculos/ Raices,PAPA BLANCA BRASIL 1 KG,GS.  16.300,https://www.superseis.com.py/images/thumbs/0213590_500.jpeg,28/12/23
Tuberculos/ Raices,MANDIOCA 1 KG,GS.  3.250,https://www.superseis.com.py/images/thumbs/0213502_500.jpeg,28/12/23
Tuberculos/ Raices,BATATA ROJA BRASIL 1KG,GS.  8.100,https://www.superseis.com.py/images/thumbs/0213495_500.jpeg,28/12/23
Tuberculos/ Raices,PAPA NEGRA X KL,GS.  8.250,https://www.superseis.com.py/images/thumbs/0213494_500.jpeg,28/12/23
Tuberculos/ Raices,ZANAHORIA 1 KG IMPORTADO,GS.  10.650,https://www.superseis.com.py/images/thumbs/0213491_500.jpeg,28/12/23
Tuberculos/ Raices,CEBOLLA DE 1RA X KL,GS.  7.800,https://www.superseis.com.py/images/thumbs/0213490_500.jpeg,28/12/23
Tuberculos/ Raices,CEBOLLA DE CABEZA 1 KG ROJA KG,GS.  17.950,https://www.superseis.com.py/images/thumbs/0213035_500.jpeg,28/12/23
Tuberculos/ Raices,BATATA KARAA,GS.  26.900,https://www.superseis.com.py/images/thumbs/0209534_500.jpeg,28/12/23
Tuberculos/ Raices,REMOLACHA 1 KG,GS.  8.950,https://www.superseis.com.py/images/thumbs/0209501_500.jpeg,28/12/23
Tuberculos/ Raices,JENGIBRE 1 KG,GS.  37.200,https://www.superseis.com.py/images/thumbs/0199551_500.jpeg,28/12/23
Tuberculos/ Raices,CEBOLLA EN MALLA MLL 1 KG ARGE,GS.  8.950,https://www.superseis.com.py/images/thumbs/0198592_500.jpeg,28/12/23
Tuberculos/ Raices,PAPA EN MALLA MLL 1 KG NEGRA,GS.  14.000,https://www.superseis.com.py/images/thumbs/0198591_500.jpeg,28/12/23
Tuberculos/ Raices,PAPITA BLANCA,GS.  12.700,https://www.superseis.com.py/images/thumbs/0169112_500.jpeg,28/12/23
Tuberculos/ Raices,REMEDIO REFRESCANTE X UNIDAD X 1,GS.  650,https://www.superseis.com.py/images/thumbs/0169006_500.jpeg,28/12/23
Tuberculos/ Raices,RABANITO X UNIDAD,GS.  3.200,https://www.superseis.com.py/images/thumbs/0169001_500.jpeg,28/12/23
