category,prod_name,prod_price,product_picture,run_date
Isotonicos,BEBIDA ISOTONICA S/CITRUS POWERADE 500ML,Gs   9.000,https://www.stock.com.py/images/thumbs/0207094_500.jpeg,10/6/24
Isotonicos,BEBIDA ISOTONICA SAB/MANZANA FULL SPORT 640ML BOT,Gs   8.500,https://www.stock.com.py/images/thumbs/0205272_500.jpeg,10/6/24
Isotonicos,BESPOWER CERO BEBIDA ISOTONICA SABOR ACAI 660 ML,Gs   7.450,https://www.stock.com.py/images/thumbs/0203810_500.jpeg,10/6/24
Isotonicos,BEBIDA ISOTONICA SABOR TROPICAL FRUIT GATORADE 500ML,Gs   9.000,https://www.stock.com.py/images/thumbs/0198764_500.jpeg,10/6/24
Isotonicos,GATORADE BEBIDA ISOTONICA SABOR MANDARINA 500 ML,Gs   9.000,https://www.stock.com.py/images/thumbs/0198763_500.jpeg,10/6/24
Isotonicos,BEBIDA ISOTONICA COOL BLUE SABOR FRAMBUESA GATORADE 500ML,Gs   9.000,https://www.stock.com.py/images/thumbs/0198762_500.jpeg,10/6/24
Isotonicos,DOUBLE DUTCH AGUA TONICA GINGER ALE 200 ML,Gs   13.500,https://www.stock.com.py/images/thumbs/0196388_500.jpeg,10/6/24
Isotonicos,DOUBLE DUTCH AGUA TONICA DOUBLE LEMON 200 ML,Gs   13.500,https://www.stock.com.py/images/thumbs/0196387_500.jpeg,10/6/24
Isotonicos,DOUBLE DUTCH AGUA TONICA CRANBERRY & GINGER TONIC WATER 200 ML,Gs   13.500,https://www.stock.com.py/images/thumbs/0196385_500.jpeg,10/6/24
Isotonicos,DOUBLE DUTCH AGUA TONICA POMEGRANATE & BASIL MIXER 200 ML,Gs   13.500,https://www.stock.com.py/images/thumbs/0196381_500.jpeg,10/6/24
Isotonicos,BEBIDA ISOTONICA MOUNTAIN BLAST POWERADE 990ML,Gs   13.000,https://www.stock.com.py/images/thumbs/0196064_500.jpeg,10/6/24
Isotonicos,ISOTONICO FRAMBUESA BLUE 640ML FULL SPORT PET,Gs   8.500,https://www.stock.com.py/images/thumbs/0190697_500.jpeg,10/6/24
Isotonicos,BEBIDA ISOTONICA NARANJA 660ML BES POWER BOT,Gs   6.900,https://www.stock.com.py/images/thumbs/0172706_500.jpeg,10/6/24
Isotonicos,BEBIDA ISOTONICA LICHI POWER TURBO 660ML BES BOT,Gs   6.900,https://www.stock.com.py/images/thumbs/0172701_500.jpeg,10/6/24
Isotonicos,BEBIDA ISOTONICA ASAI POWER ULTRA 660ML BES BOT,Gs   6.900,https://www.stock.com.py/images/thumbs/0172700_500.jpeg,10/6/24
Isotonicos,BEBIDA ISOTONICA POWERADE MULTIFRUTAS 500ML,Gs   9.000,https://www.stock.com.py/images/thumbs/0165566_500.png,10/6/24
Isotonicos,BEBIDA ISOTONICA POWERADE MOUNT BLAST 500ML,Gs   9.000,https://www.stock.com.py/images/thumbs/0165565_500.png,10/6/24
Isotonicos,BEBIDA ISOTONICA POWERADE MANZANA 500ML,Gs   9.000,https://www.stock.com.py/images/thumbs/0165564_500.png,10/6/24
Isotonicos,BEBIDA POWERADE MOUNTAIN 6X500,Gs   45.000,https://www.stock.com.py/images/thumbs/0149829_500.jpeg,10/6/24
Preparados,PURE D/MANZANA/PERA/ BANANA ZUMMY 90GR,Gs   1.500,https://www.stock.com.py/images/thumbs/0201628_500.png,10/6/24
Preparados,PURE D/MANZANA/DURAZNO ZUMMY 90GR,Gs   1.500,https://www.stock.com.py/images/thumbs/0201627_500.png,10/6/24
Preparados,PURE DE MANZANA ZUMMY 90GR,Gs   1.500,https://www.stock.com.py/images/thumbs/0201626_500.png,10/6/24
Preparados,PURE DE PERAS ZUMMY 90GR,Gs   1.500,https://www.stock.com.py/images/thumbs/0201625_500.png,10/6/24
Otros Artículos,INSECTICIDA LIQUIDO PIRETROIDE MAPEX 100ml ,Gs   29.300,https://www.stock.com.py/images/thumbs/0186104_500.jpeg,10/6/24
Otros Artículos,GUANTE DE TRABAJO STANFORD,Gs   20.000,https://www.stock.com.py/images/thumbs/0182077_500.jpeg,10/6/24
Otros Artículos,GUANTE DE TRABAJO  STANFORD S/E REF ST-160302,Gs   10.000,https://www.stock.com.py/images/thumbs/noDefaultImage_stock_500.gif,10/6/24
Gelatinas,GELATINA SABOR FRUTILLA DIETALAT PARMALAT 180GR,Gs   2.300,https://www.stock.com.py/images/thumbs/0187590_500.jpeg,10/6/24
Gelatinas,GELATINA SABOR TUTTI FRUTTI PARMALAT 125GR,Gs   2.100,https://www.stock.com.py/images/thumbs/0187585_500.jpeg,10/6/24
Gelatinas,GELATINAS PARMALAT GELATINA SABOR NARANJA PARMALAT 125GRPOTE 125 GRAMOS,Gs   2.100,https://www.stock.com.py/images/thumbs/0187581_500.jpeg,10/6/24
Gelatinas,GELATINA SABOR FRUTILLA PARMALAT 125GR,Gs   2.100,https://www.stock.com.py/images/thumbs/0187580_500.jpeg,10/6/24
Gelatinas,GELATINA SABOR UVA PARMALAT 125GR,Gs   2.100,https://www.stock.com.py/images/thumbs/0187579_500.jpeg,10/6/24
Gelatinas,GELATINA DIET MANZANA VERDE 180GR LA PRADERA POTE,Gs   2.500,https://www.stock.com.py/images/thumbs/0173695_500.png,10/6/24
Gelatinas,GELATINA DIET DE FRUTILLA 180GR LA PRADERA POTE,Gs   2.500,https://www.stock.com.py/images/thumbs/0173694_500.png,10/6/24
Gelatinas,POSTRE GELATINA D/MANZANA VERDE 120GR LA PRADERA POTE ,Gs   2.100,https://www.stock.com.py/images/thumbs/0171867_500.png,10/6/24
Gelatinas,POSTRE GELATINA D/UVA 120GR LA PRADERA POT,Gs   2.100,https://www.stock.com.py/images/thumbs/0171865_500.png,10/6/24
Untables Env,CREMA DE RICOTA LIGHT POLENGHI 150GR UN,Gs   13.200,https://www.stock.com.py/images/thumbs/0206356_500.jpeg,10/6/24
Untables Env,LOS COLONOS QUESO CREMA 200 GR,Gs   10.700,https://www.stock.com.py/images/thumbs/0206310_500.jpeg,10/6/24
Untables Env,QUESO UNTABLE PORT SALUT CLASICO 190GR SANCOR POT,Gs   20.950,https://www.stock.com.py/images/thumbs/0199169_500.jpeg,10/6/24
Untables Env,QUESO UNTABLE 4 QUESOS THOLEM 190GR,Gs   20.800,https://www.stock.com.py/images/thumbs/0195967_500.jpeg,10/6/24
Untables Env,QUESO UNTABLE SABOR JAMON DE LA SIERRA THOLEM 190GR,Gs   20.800,https://www.stock.com.py/images/thumbs/0195966_500.jpeg,10/6/24
Untables Env,QUESO UNTABLE CLASICO THOLEM 190GR,Gs   20.800,https://www.stock.com.py/images/thumbs/0195965_500.jpeg,10/6/24
Untables Env,QUESO LIGHT EN HEBRAS QUESABORES SANCOR 150GR,Gs   45.000,https://www.stock.com.py/images/thumbs/0195957_500.jpeg,10/6/24
Untables Env,QUESO UNTABLE SABOR CHEDDAR 200GR TREBOL,Gs   10.100,https://www.stock.com.py/images/thumbs/0191726_500.jpeg,10/6/24
Untables Env,QUESO CHEDDAR LIGHT PARA SANDWICH POLENGHI 144GR,Gs   17.800,https://www.stock.com.py/images/thumbs/0187877_500.jpeg,10/6/24
Untables Env,QUESO CREAM CHEESE TRADICIONAL POLENGHI 150GR,Gs   16.500,https://www.stock.com.py/images/thumbs/0187875_500.jpeg,10/6/24
Untables Env,QUESO CREAM CHEESE LIGHT POLENGHI 150GR,Gs   16.500,https://www.stock.com.py/images/thumbs/0187874_500.jpeg,10/6/24
Untables Env,QUESO REQUESON TRADICIONAL POLENGHI 200GR,Gs   17.500,https://www.stock.com.py/images/thumbs/0187872_500.jpeg,10/6/24
Untables Env,QUESO REQUESON LIGHT POLENGHI 200GR,Gs   9.200,https://www.stock.com.py/images/thumbs/0187871_500.jpeg,10/6/24
Untables Env,QUESO REQUESON LIGHT ZERO LACTOSA POLENGHI 200GR,Gs   27.500,https://www.stock.com.py/images/thumbs/0187864_500.jpeg,10/6/24
Untables Env,QUESO EMMENTAL EN FETAS PRESIDENT 200GR,Gs   32.650,https://www.stock.com.py/images/thumbs/0187562_500.jpeg,10/6/24
Untables Env,QUESO BRIE PRESIDENT 125GR,Gs   45.500,https://www.stock.com.py/images/thumbs/0187556_500.jpeg,10/6/24
Untables Env,QUESO CREMOSO SABOR AJO 200GR TREBOL,Gs   10.100,https://www.stock.com.py/images/thumbs/0180864_500.jpeg,10/6/24
Untables Env,QUESO CONAPROLE REQUESON POT,Gs   18.900,https://www.stock.com.py/images/thumbs/0179999_500.jpeg,10/6/24
Untables Env,QUESO CONAPROLE REQUESÓN LIGHT,Gs   18.900,https://www.stock.com.py/images/thumbs/0179998_500.jpeg,10/6/24
Untables Env,QUESO FUNDIDO DANBO LACTOLANDA DE 200GR ,Gs   12.000,https://www.stock.com.py/images/thumbs/0161581_500.png,10/6/24
Untables Env,QUESO CREMOSO UNTABLE LACTOLANDA X 200GR,Gs   12.000,https://www.stock.com.py/images/thumbs/0161572_500.png,10/6/24
Untables Env,QUESO FUNDIDO DIETETICO 180 GR,Gs   15.400,https://www.stock.com.py/images/thumbs/0149388_500.jpeg,10/6/24
Untables Env,QUESO REQUESON TREBOL SACHET 250GR,Gs   14.400,https://www.stock.com.py/images/thumbs/0148513_500.jpeg,10/6/24
Dulces Sólidos,"DULCE BATATA ""LOS NIETITOS"" 400 GR.",Gs   32.000,https://www.stock.com.py/images/thumbs/0207992_500.jpeg,10/6/24
Dulces Sólidos,MERMELADA D/NARAN DIET LOS NIETITOS 340G,Gs   32.000,https://www.stock.com.py/images/thumbs/0207390_500.jpeg,10/6/24
Dulces Sólidos,MERMELADA D/FRUT DIET LOS NIETITOS 340GR,Gs   32.000,https://www.stock.com.py/images/thumbs/0207389_500.jpeg,10/6/24
Dulces Sólidos,DULCE DE BATATA ARCOR 500 GR,Gs   12.000,https://www.stock.com.py/images/thumbs/0206453_500.jpeg,10/6/24
Dulces Sólidos,CAFE E/CAPSULAS CAP. CABRALES 114GR 12UN,Gs   51.300,https://www.stock.com.py/images/thumbs/0204931_500.jpeg,10/6/24
Dulces Sólidos,PRIMICIA DULCE DE MAMON 400 GR,Gs   14.900,https://www.stock.com.py/images/thumbs/0204530_500.jpeg,10/6/24
Dulces Sólidos,LIGHT DULCE D.ROSA MOSQ PATAGONIA 265GR,Gs   33.700,https://www.stock.com.py/images/thumbs/0204446_500.jpeg,10/6/24
Dulces Sólidos,LIGHT DULCE D ARAND. PATAGONIA 265GR,Gs   33.700,https://www.stock.com.py/images/thumbs/0204443_500.jpeg,10/6/24
Dulces Sólidos,DULCE DE BATATA GLORIA 200GR PLAST,Gs   4.250,https://www.stock.com.py/images/thumbs/0203206_500.jpeg,10/6/24
Dulces Sólidos,DULCE DE MEMBRILLO ORIETA 500GR,Gs   13.900,https://www.stock.com.py/images/thumbs/0203057_500.jpeg,10/6/24
Dulces Sólidos,DULCE DE BATATA DON?A FLORA 200GR,Gs   3.750,https://www.stock.com.py/images/thumbs/0202609_500.jpeg,10/6/24
Dulces Sólidos,DULCE DE BATATA DON?A FLORA 400GR,Gs   6.900,https://www.stock.com.py/images/thumbs/0202608_500.jpeg,10/6/24
Dulces Sólidos,DULCE DE BATATA DON?A FLORA 600GR,Gs   9.350,https://www.stock.com.py/images/thumbs/0202607_500.jpeg,10/6/24
Dulces Sólidos,MANI MOLIDO SABORES DE AREGUA 250GR PAQ,Gs   7.150,https://www.stock.com.py/images/thumbs/0201807_500.jpeg,10/6/24
Dulces Sólidos,KAI LADRILLO SABORES DE AREGUA 400 GR,Gs   10.500,https://www.stock.com.py/images/thumbs/0201806_500.jpeg,10/6/24
Dulces Sólidos,DULCE DE MANI SABORES DE AREGUA 200GR,Gs   6.600,https://www.stock.com.py/images/thumbs/0201805_500.jpeg,10/6/24
Dulces Sólidos,DULCE DE BATATA LIGHT SABORES DE AREGUA 460GR,Gs   14.900,https://www.stock.com.py/images/thumbs/0201804_500.jpeg,10/6/24
Dulces Sólidos,DULCE DE BATATA EN BARRA BON GUSTO 450GR,Gs   8.550,https://www.stock.com.py/images/thumbs/0195079_500.jpeg,10/6/24
Dulces Sólidos,DULCE DE BATATA EN BARRA BON GUSTO 200GR,Gs   4.400,https://www.stock.com.py/images/thumbs/0195078_500.jpeg,10/6/24
Dulces Sólidos,DULCE DE GUAYABA EN BARRA BON GUSTO 400GR,Gs   7.700,https://www.stock.com.py/images/thumbs/0195077_500.jpeg,10/6/24
Dulces Sólidos,DULCE DE GUAYABA EN BARRA BON GUSTO 200GR,Gs   4.800,https://www.stock.com.py/images/thumbs/0195076_500.jpeg,10/6/24
Dulces Sólidos,MERMELADA DE GUAYABA LIGHT BON GUSTO 450GR,Gs   16.600,https://www.stock.com.py/images/thumbs/0195075_500.jpeg,10/6/24
Dulces Sólidos,"MANI CON COCO, CANELA Y AZUCAR DUL-CESAR 500GR",Gs   16.850,https://www.stock.com.py/images/thumbs/0191954_500.jpeg,10/6/24
Dulces Sólidos,DULCE DE BATATA CON CHOCOLATE DUL-CESAR 200GR,Gs   5.250,https://www.stock.com.py/images/thumbs/0191952_500.jpeg,10/6/24
Dulces Sólidos,DULCE DE BATATA CON CHOCOLATE DUL-CESAR 400GR,Gs   9.950,https://www.stock.com.py/images/thumbs/0191951_500.jpeg,10/6/24
Dulces Sólidos,MANI MOLIDO DUL-CESAR 250GR,Gs   7.600,https://www.stock.com.py/images/thumbs/0191948_500.jpeg,10/6/24
Dulces Sólidos,GLORIA DULCE DE BATATA CON CHOCOLATE 200 GR,Gs   4.350,https://www.stock.com.py/images/thumbs/0182334_500.jpeg,10/6/24
Dulces Sólidos,GLORIA DULCE DE BATATA CON CHOCOLATE 400 GR,Gs   7.900,https://www.stock.com.py/images/thumbs/0182333_500.jpeg,10/6/24
Galletitas/Postres,ALFAJOR DE ARROZ RELL/D/LIM LULEMUU 22GR,Gs   5.900,https://www.stock.com.py/images/thumbs/0207976_500.jpeg,10/6/24
Galletitas/Postres,ALFAJOR DE ARROZ DUL/D/LEC LULEMUU 15GR,Gs   5.900,https://www.stock.com.py/images/thumbs/0207975_500.jpeg,10/6/24
Galletitas/Postres,ALFAJOR DE ARROZ DULCE/LEC LULEMUU 22GR,Gs   5.900,https://www.stock.com.py/images/thumbs/0207973_500.jpeg,10/6/24
Galletitas/Postres,PREMEZCLA 3 HARINAS MANDI'O 800GR,Gs   15.000,https://www.stock.com.py/images/thumbs/0207559_500.jpeg,10/6/24
Galletitas/Postres,PREMEZCLA 3HARINAS MANDI'O 800GR,Gs   16.500,https://www.stock.com.py/images/thumbs/0207558_500.jpeg,10/6/24
Galletitas/Postres,POLVO P/BIZCOCH D/VAINILLA MANDI'O 500GR,Gs   21.000,https://www.stock.com.py/images/thumbs/0207539_500.jpeg,10/6/24
Galletitas/Postres,SCHAR GNOCHI ?OQUIS DE PAPAS 300 GR,Gs   40.500,https://www.stock.com.py/images/thumbs/0204681_500.jpeg,10/6/24
Galletitas/Postres,SCHAR BUDIN DE NARANJA SIN GLUTEN 200 GR,Gs   29.500,https://www.stock.com.py/images/thumbs/0204675_500.jpeg,10/6/24
Galletitas/Postres,SCHAR BUDIN DE CHOCOLATE SIN GLUTEN 200 GR,Gs   29.500,https://www.stock.com.py/images/thumbs/0204674_500.jpeg,10/6/24
Galletitas/Postres,SCHAR PAN BLANCO SIN GLUTEN 200 GR,Gs   28.000,https://www.stock.com.py/images/thumbs/0204673_500.jpeg,10/6/24
Galletitas/Postres,MAZZEI CEREAL AROS FRUTALES LIBRE DE GLUTEN 230 GR,Gs   15.500,https://www.stock.com.py/images/thumbs/0204590_500.jpeg,10/6/24
Galletitas/Postres,MAZZEI CEREAL HOJUELAS LIBRE DE GLUTEN 300 GR,Gs   16.000,https://www.stock.com.py/images/thumbs/0204589_500.jpeg,10/6/24
Galletitas/Postres,LESTELLO GALLETAS DE QUINOA CUBIERTO CON CHOCOLATE AMARGO Y CEREZA LIOFILIZADA 36 GR,Gs   22.000,https://www.stock.com.py/images/thumbs/0203287_500.jpeg,10/6/24
Galletitas/Postres,LESTELLO GALLETAS DE QUINOA 130  GR,Gs   26.000,https://www.stock.com.py/images/thumbs/0203286_500.jpeg,10/6/24
Galletitas/Postres,LESTELLO GALLETAS DE GARBANZO CUBIERTA CON CHOCOLATE AMARGO 34 GR,Gs   22.000,https://www.stock.com.py/images/thumbs/0203285_500.jpeg,10/6/24
Galletitas/Postres,LESTELLO GALLETA A BASE DE ARROZ INTEGRAL SORGO ARROZ ROJO AMARANTO CA?AMO CHIA Y QUINOA 65 GR,Gs   22.000,https://www.stock.com.py/images/thumbs/0203284_500.jpeg,10/6/24
Galletitas/Postres,LESTELLO GALLETAS DE TRIGO SARRACENO 135 GR,Gs   26.000,https://www.stock.com.py/images/thumbs/0203283_500.jpeg,10/6/24
Galletitas/Postres,LESTELLO MIJO INFLADO 100 GR,Gs   22.000,https://www.stock.com.py/images/thumbs/0203282_500.jpeg,10/6/24
Galletitas/Postres,LESTELLO TRIGO INFLADO 100 GR,Gs   22.000,https://www.stock.com.py/images/thumbs/0203281_500.jpeg,10/6/24
Galletitas/Postres,PREMEZCLA P/ELAB PANIFICADOS MANDIO 500G,Gs   24.100,https://www.stock.com.py/images/thumbs/0202636_500.jpeg,10/6/24
Galletitas/Postres,OBLEA D/ARROZ C/RELLENO D/LIMON LULEMUU 15GR PLAST,Gs   4.500,https://www.stock.com.py/images/thumbs/0202471_500.jpeg,10/6/24
Galletitas/Postres,ALFAJOR D/ARROZ RELL C/DULCE D/LECHE LULEMUU 17GR PLAST,Gs   5.900,https://www.stock.com.py/images/thumbs/0202470_500.jpeg,10/6/24
Galletitas/Postres,AMADDA PAN RALLADO 500 GR,Gs   42.000,https://www.stock.com.py/images/thumbs/0201119_500.jpeg,10/6/24
Galletitas/Postres,DELUXE GALLETITAS DE ARROZ BA?ADAS CON YOGURT DE FRUTILLA 115 GR,Gs   17.550,https://www.stock.com.py/images/thumbs/0201113_500.jpeg,10/6/24
Galletitas/Postres,GULLON FINAS GALLETA AVENA CON COBERTURA CHOCO LECHE ZERO 150 GR,Gs   25.900,https://www.stock.com.py/images/thumbs/0200897_500.jpeg,10/6/24
Galletitas/Postres,GULLON GALLETA CON CREMA SABOR CHOCOLATE 225 GR,Gs   25.900,https://www.stock.com.py/images/thumbs/0200896_500.jpeg,10/6/24
Galletitas/Postres,GULLON GALLETA CON CHIPS DE CHOCOLATE Y COPOS DE AVENA 220 GR,Gs   25.900,https://www.stock.com.py/images/thumbs/0200895_500.jpeg,10/6/24
Galletitas/Postres,QUALICOCO SALSA TIPO SHOYU DE COCO LIGHT 250 ML,Gs   33.250,https://www.stock.com.py/images/thumbs/0200766_500.jpeg,10/6/24
Aseo,CEPILLO DENTAL PARA NIÑOS BARBIE COLGATE,Gs   26.000,https://www.stock.com.py/images/thumbs/0206556_500.jpeg,10/6/24
Aseo,CEPILLO DENTAL NIÑOS EXTRA SUAVE COLGATE,Gs   26.000,https://www.stock.com.py/images/thumbs/0206551_500.jpeg,10/6/24
Aseo,CEPILLO DENTAL BABELITO 1,Gs   12.000,https://www.stock.com.py/images/thumbs/0202192_500.jpeg,10/6/24
Aseo,ASPIRADOR NASAL BABELITO 1,Gs   22.500,https://www.stock.com.py/images/thumbs/0146279_500.jpeg,10/6/24
Flanes,FLAN SABOR MANJAR COLUN 100GR,Gs   3.250,https://www.stock.com.py/images/thumbs/0194890_500.jpeg,10/6/24
Flanes,FLAN SABOR CHOCOLATE COLUN 100GR,Gs   3.250,https://www.stock.com.py/images/thumbs/0194888_500.jpeg,10/6/24
Flanes,FLAN SABOR VAINILLA LOS COLONOS 120GR POT,Gs   2.900,https://www.stock.com.py/images/thumbs/0183694_500.jpeg,10/6/24
Flanes,FLAN DONA ANGELA POTE 140 GR,Gs   3.550,https://www.stock.com.py/images/thumbs/0178580_500.jpeg,10/6/24
Flanes,FLAN LACTOLANDA VAINILLA POTE 140GR,Gs   3.100,https://www.stock.com.py/images/thumbs/0161571_500.png,10/6/24
Flanes,FLAN TREBOL POTE 140 GR,Gs   3.100,https://www.stock.com.py/images/thumbs/0148483_500.jpeg,10/6/24
Galletitas/Postres,ALFAJOR DE ARROZ RELL/D/LIM LULEMUU 22GR,Gs   5.900,https://www.stock.com.py/images/thumbs/0207976_500.jpeg,10/6/24
Galletitas/Postres,ALFAJOR DE ARROZ DUL/D/LEC LULEMUU 15GR,Gs   5.900,https://www.stock.com.py/images/thumbs/0207975_500.jpeg,10/6/24
Galletitas/Postres,ALFAJOR DE ARROZ DULCE/LEC LULEMUU 22GR,Gs   5.900,https://www.stock.com.py/images/thumbs/0207973_500.jpeg,10/6/24
Galletitas/Postres,PREMEZCLA 3 HARINAS MANDI'O 800GR,Gs   15.000,https://www.stock.com.py/images/thumbs/0207559_500.jpeg,10/6/24
Galletitas/Postres,PREMEZCLA 3HARINAS MANDI'O 800GR,Gs   16.500,https://www.stock.com.py/images/thumbs/0207558_500.jpeg,10/6/24
Galletitas/Postres,POLVO P/BIZCOCH D/VAINILLA MANDI'O 500GR,Gs   21.000,https://www.stock.com.py/images/thumbs/0207539_500.jpeg,10/6/24
Galletitas/Postres,SCHAR GNOCHI ?OQUIS DE PAPAS 300 GR,Gs   40.500,https://www.stock.com.py/images/thumbs/0204681_500.jpeg,10/6/24
Galletitas/Postres,SCHAR BUDIN DE NARANJA SIN GLUTEN 200 GR,Gs   29.500,https://www.stock.com.py/images/thumbs/0204675_500.jpeg,10/6/24
Galletitas/Postres,SCHAR BUDIN DE CHOCOLATE SIN GLUTEN 200 GR,Gs   29.500,https://www.stock.com.py/images/thumbs/0204674_500.jpeg,10/6/24
Galletitas/Postres,SCHAR PAN BLANCO SIN GLUTEN 200 GR,Gs   28.000,https://www.stock.com.py/images/thumbs/0204673_500.jpeg,10/6/24
Galletitas/Postres,MAZZEI CEREAL AROS FRUTALES LIBRE DE GLUTEN 230 GR,Gs   15.500,https://www.stock.com.py/images/thumbs/0204590_500.jpeg,10/6/24
Galletitas/Postres,MAZZEI CEREAL HOJUELAS LIBRE DE GLUTEN 300 GR,Gs   16.000,https://www.stock.com.py/images/thumbs/0204589_500.jpeg,10/6/24
Galletitas/Postres,LESTELLO GALLETAS DE QUINOA CUBIERTO CON CHOCOLATE AMARGO Y CEREZA LIOFILIZADA 36 GR,Gs   22.000,https://www.stock.com.py/images/thumbs/0203287_500.jpeg,10/6/24
Galletitas/Postres,LESTELLO GALLETAS DE QUINOA 130  GR,Gs   26.000,https://www.stock.com.py/images/thumbs/0203286_500.jpeg,10/6/24
Galletitas/Postres,LESTELLO GALLETAS DE GARBANZO CUBIERTA CON CHOCOLATE AMARGO 34 GR,Gs   22.000,https://www.stock.com.py/images/thumbs/0203285_500.jpeg,10/6/24
Galletitas/Postres,LESTELLO GALLETA A BASE DE ARROZ INTEGRAL SORGO ARROZ ROJO AMARANTO CA?AMO CHIA Y QUINOA 65 GR,Gs   22.000,https://www.stock.com.py/images/thumbs/0203284_500.jpeg,10/6/24
Galletitas/Postres,LESTELLO GALLETAS DE TRIGO SARRACENO 135 GR,Gs   26.000,https://www.stock.com.py/images/thumbs/0203283_500.jpeg,10/6/24
Galletitas/Postres,LESTELLO MIJO INFLADO 100 GR,Gs   22.000,https://www.stock.com.py/images/thumbs/0203282_500.jpeg,10/6/24
Galletitas/Postres,LESTELLO TRIGO INFLADO 100 GR,Gs   22.000,https://www.stock.com.py/images/thumbs/0203281_500.jpeg,10/6/24
Galletitas/Postres,PREMEZCLA P/ELAB PANIFICADOS MANDIO 500G,Gs   24.100,https://www.stock.com.py/images/thumbs/0202636_500.jpeg,10/6/24
Galletitas/Postres,OBLEA D/ARROZ C/RELLENO D/LIMON LULEMUU 15GR PLAST,Gs   4.500,https://www.stock.com.py/images/thumbs/0202471_500.jpeg,10/6/24
Galletitas/Postres,ALFAJOR D/ARROZ RELL C/DULCE D/LECHE LULEMUU 17GR PLAST,Gs   5.900,https://www.stock.com.py/images/thumbs/0202470_500.jpeg,10/6/24
Galletitas/Postres,AMADDA PAN RALLADO 500 GR,Gs   42.000,https://www.stock.com.py/images/thumbs/0201119_500.jpeg,10/6/24
Galletitas/Postres,DELUXE GALLETITAS DE ARROZ BA?ADAS CON YOGURT DE FRUTILLA 115 GR,Gs   17.550,https://www.stock.com.py/images/thumbs/0201113_500.jpeg,10/6/24
Galletitas/Postres,GULLON FINAS GALLETA AVENA CON COBERTURA CHOCO LECHE ZERO 150 GR,Gs   25.900,https://www.stock.com.py/images/thumbs/0200897_500.jpeg,10/6/24
Galletitas/Postres,GULLON GALLETA CON CREMA SABOR CHOCOLATE 225 GR,Gs   25.900,https://www.stock.com.py/images/thumbs/0200896_500.jpeg,10/6/24
Galletitas/Postres,GULLON GALLETA CON CHIPS DE CHOCOLATE Y COPOS DE AVENA 220 GR,Gs   25.900,https://www.stock.com.py/images/thumbs/0200895_500.jpeg,10/6/24
Galletitas/Postres,QUALICOCO SALSA TIPO SHOYU DE COCO LIGHT 250 ML,Gs   33.250,https://www.stock.com.py/images/thumbs/0200766_500.jpeg,10/6/24
Para Niños,JUGUETE KIT DE HERRAMIENTAS DY GRANDE,Gs   64.900,https://www.stock.com.py/images/thumbs/0207608_500.png,10/6/24
Para Niños,JUGUETE DIPLODOCUS DY,Gs   54.900,https://www.stock.com.py/images/thumbs/0207607_500.png,10/6/24
Para Niños,JUGUETE TREN ELECT DY REF 4299-82,Gs   54.900,https://www.stock.com.py/images/thumbs/0207603_500.png,10/6/24
Para Niños,JUGUETE BOXEO DY MEDIANO,Gs   98.900,https://www.stock.com.py/images/thumbs/0207591_500.png,10/6/24
Para Niños,JUGUETE TYRANOSAURIO DY,Gs   79.900,https://www.stock.com.py/images/thumbs/0207583_500.png,10/6/24
Para Niños,JUGUETE GUERRERO D/ESPAC BLI PICAPAU 768,Gs   69.900,https://www.stock.com.py/images/thumbs/0205666_500.png,10/6/24
Para Niños,JUGUETE TIRO AL BLANCO MK BLIS MKQ401004,Gs   15.500,https://www.stock.com.py/images/thumbs/0205643_500.png,10/6/24
Para Niños,JUGUETE JUEGO D/TALADRO CJA MKM487570,Gs   83.900,https://www.stock.com.py/images/thumbs/0205636_500.png,10/6/24
Para Niños,JUGUETE SET D/FERRETERIA CJA MKM247027,Gs   156.900,https://www.stock.com.py/images/thumbs/0205623_500.png,10/6/24
Para Niños,RECARGA BLAZE STORM C/ 20 DARDOS 6606 XPLAST,Gs   20.900,https://www.stock.com.py/images/thumbs/0205584_500.jpeg,10/6/24
Para Niños,SET DE PISTOLAS LANZA DARDO BLAZE C/ 10 DARDOS 6601 XPLAST,Gs   73.500,https://www.stock.com.py/images/thumbs/0205582_500.jpeg,10/6/24
Para Niños,JUGUETE BATMAN 6CM PICI 6060835,Gs   120.000,https://www.stock.com.py/images/thumbs/0199657_500.jpeg,10/6/24
Para Niños,JUGUETE BATMAN 12CM PICI 6060653,Gs   269.000,https://www.stock.com.py/images/thumbs/0199656_500.jpeg,10/6/24
Para Niños,JUGUETE MUÑECOS DIS VRIOS PICI 6056331,Gs   150.000,https://www.stock.com.py/images/thumbs/0199652_500.jpeg,10/6/24
Para Niños,JUGUETE MUÑECOS DIS VRIOS PICI 6055412,Gs   79.000,https://www.stock.com.py/images/thumbs/0199650_500.jpeg,10/6/24
Para Niños,JUGUETE MINI AMIGOS SPIDEY PICI 14915L01,Gs   105.000,https://www.stock.com.py/images/thumbs/0199314_500.jpeg,10/6/24
Para Niños,JUGUETE BLACK PANTHER 12CM PICI 21555X00,Gs   255.000,https://www.stock.com.py/images/thumbs/0199292_500.jpeg,10/6/24
Para Niños,JUEGO CAJA DE HERREMIENTA D/ MADERA PEPI REF 1301 S/E ,Gs   119.900,https://www.stock.com.py/images/thumbs/noDefaultImage_stock_500.gif,10/6/24
Para Niños,JUGUETE PISTOLA C/DARDO BOLSA MK REF MKI367091 ,Gs   900,https://www.stock.com.py/images/thumbs/noDefaultImage_stock_500.gif,10/6/24
Para Niños,.,Gs   82.500,https://www.stock.com.py/images/thumbs/noDefaultImage_stock_500.gif,10/6/24
Guantes,GUANTES SUPERIOR PEQUEÑO TAMAÑO S VIRUTEX 1PAR,Gs   13.050,https://www.stock.com.py/images/thumbs/0198617_500.jpeg,11/6/24
Guantes,GUANTES DE LATEX TAMAÑO L PULOIL ,Gs   12.500,https://www.stock.com.py/images/thumbs/0195165_500.jpeg,11/6/24
Guantes,GUANTES DE LATEX TAMAÑO M PULOIL ,Gs   12.500,https://www.stock.com.py/images/thumbs/0195164_500.jpeg,11/6/24
Guantes,GUANTE DE LATEX ROJO JASPE,Gs   19.600,https://www.stock.com.py/images/thumbs/0186094_500.jpeg,11/6/24
Guantes,GUANTE SCOTCH BRITE TAREAS PESADAS P,Gs   13.600,https://www.stock.com.py/images/thumbs/0176578_500.jpeg,11/6/24
Guantes,GUANTES DE GOMA Nª7,Gs   13.800,https://www.stock.com.py/images/thumbs/0176512_500.jpeg,11/6/24
Guantes,GUANTE DE GOMA CONDOR TAMAÑO MEDIANO,Gs   14.750,https://www.stock.com.py/images/thumbs/0174002_500.jpeg,11/6/24
Guantes,GUANTE SCOTCH BRITE MULTIUSO PEQUEÑO,Gs   17.900,https://www.stock.com.py/images/thumbs/0165249_500.png,11/6/24
Guantes,GUANTE SCOTCH BRITE MULTIUSO MEDIANO,Gs   15.500,https://www.stock.com.py/images/thumbs/0165248_500.png,11/6/24
Guantes,TRAPO P/PISO 45X50CM GREEN COTTON GREEN,Gs   6.500,https://www.stock.com.py/images/thumbs/0158305_500.jpeg,11/6/24
Guantes,GUANTE PLUMITA GRANDE,Gs   9.900,https://www.stock.com.py/images/thumbs/0146476_500.jpeg,11/6/24
Guantes,GUANTE PLUMITA MEDIANO,Gs   9.900,https://www.stock.com.py/images/thumbs/0146475_500.jpeg,11/6/24
Guantes,GUANTE PLUMITA CHICO,Gs   9.900,https://www.stock.com.py/images/thumbs/0146474_500.jpeg,11/6/24
Guantes,GUANTE VIRULANA MULTIUSO GRANDE,Gs   14.300,https://www.stock.com.py/images/thumbs/0146473_500.jpeg,11/6/24
Guantes,GUANTE VIRULANA MULTIUSO MEDIANO,Gs   14.300,https://www.stock.com.py/images/thumbs/0146472_500.jpeg,11/6/24
Guantes,GUANTE VIRULANA MULTIUSO PEQUEÑO VIRULANA,Gs   14.300,https://www.stock.com.py/images/thumbs/0146471_500.jpeg,11/6/24
Guantes,GUANTES 3M PAQUETE 1 PAR TAREAS PE,Gs   16.100,https://www.stock.com.py/images/thumbs/0138825_500.jpeg,11/6/24
Guantes,GUANTE SCOTCH BRITE TAREAS PESADAS M,Gs   18.500,https://www.stock.com.py/images/thumbs/0138824_500.jpeg,11/6/24
Guantes,GUANTE SCOTCH BRITE TAREAS DELICADAS P,Gs   18.500,https://www.stock.com.py/images/thumbs/0138818_500.jpeg,11/6/24
Guantes,GUANTE CONVENIENTE MEDIANO VIRUTEX BSA,Gs   13.050,https://www.stock.com.py/images/thumbs/noDefaultImage_stock_500.gif,11/6/24
Vajillas Descartables,BANDEJA DE ALUMINIO PAR/HOR GIOPACK 500M,Gs   13.900,https://www.stock.com.py/images/thumbs/0207435_500.jpeg,11/6/24
Vajillas Descartables,BANDEJA DE ALUM/P/HOR GIOPACK 220ML 4UN,Gs   9.900,https://www.stock.com.py/images/thumbs/0207434_500.jpeg,11/6/24
Vajillas Descartables,BANDEJA DE ALUMINIO DESC/P/HOR GIOPACK 4,Gs   17.600,https://www.stock.com.py/images/thumbs/0207432_500.jpeg,11/6/24
