category,prod_name,prod_price,product_picture,run_date
Vodka,GIN ORIGINAL WHITLEY NEILL 700ML,Gs   200.000,https://www.stock.com.py/images/thumbs/0202934_500.jpeg,17/6/24
Vodka,GIN LONDON STRAWBERRY 700ML CON COPA,Gs   121.000,https://www.stock.com.py/images/thumbs/0202930_500.jpeg,17/6/24
Vodka,VODKA BOLS 700ML BOT,Gs   56.250,https://www.stock.com.py/images/thumbs/0201490_500.png,17/6/24
Vodka,GIN HENKES 700 ML,Gs   84.750,https://www.stock.com.py/images/thumbs/0201489_500.jpeg,17/6/24
Vodka,GORDON-S THE ORIGINAL LONDON DRY GIN 750 ML,Gs   41.000,https://www.stock.com.py/images/thumbs/0201476_500.png,17/6/24
Vodka,GORDON-S SICILIAN LEMON DISTILLED GIN 700 ML,Gs   64.800,https://www.stock.com.py/images/thumbs/0201475_500.png,17/6/24
Vodka,MIKE-S HARD LEMONADE BEBIDA ALCOHOLICA 269 ML,Gs   5.000,https://www.stock.com.py/images/thumbs/0200817_500.jpeg,17/6/24
Vodka,VODKA BLUE ABSOLUT 750ML,Gs   119.000,https://www.stock.com.py/images/thumbs/0198676_500.jpeg,17/6/24
Vodka,VODKA VAINILLA ABSOLUT 750ML,Gs   108.000,https://www.stock.com.py/images/thumbs/0198675_500.jpeg,17/6/24
Vodka,GIN PREMIUM BLACK 700ML PUERTO DE INDIAS,Gs   184.350,https://www.stock.com.py/images/thumbs/0197554_500.jpeg,17/6/24
Vodka,CITY OF LONDON GIN LEMON 700 ML,Gs   110.000,https://www.stock.com.py/images/thumbs/0196371_500.jpeg,17/6/24
Vodka,GIN ORGANIC WILD BOTANICALS BERTONI 700ML,Gs   160.000,https://www.stock.com.py/images/thumbs/0196054_500.jpeg,17/6/24
Vodka,GIN 700 ML CLASICO CELESTE PUERTO DE INDIAS BOT,Gs   134.500,https://www.stock.com.py/images/thumbs/0194553_500.jpeg,17/6/24
Vodka,GIN 700 ML STRAWBERRY PUERTO DE INDIAS BOT,Gs   173.900,https://www.stock.com.py/images/thumbs/0194552_500.jpeg,17/6/24
Vodka,GIN MG LONDON DRY 700ML,Gs   56.000,https://www.stock.com.py/images/thumbs/0194399_500.jpeg,17/6/24
Vodka,ROCK-S GIN DOCE STRAWBERRY 995 ML,Gs   44.000,https://www.stock.com.py/images/thumbs/0193588_500.jpeg,17/6/24
Vodka,DUROYALE GIN TONICA 275 ML,Gs   6.300,https://www.stock.com.py/images/thumbs/0193524_500.jpeg,17/6/24
Terere/Mate,SUPERUTIL BOMBILLA INOXIDABLE COLOR VIOL,Gs   14.700,https://www.stock.com.py/images/thumbs/0203224_500.jpeg,17/6/24
Terere/Mate,SUPERUTIL BOMBILLA INOXIDABLE COLOR ROJO,Gs   14.700,https://www.stock.com.py/images/thumbs/0203223_500.jpeg,17/6/24
Terere/Mate,PINNACLE TERMO PARA AGUA FRIA PLUTO 2.5 LITROS,Gs   52.900,https://www.stock.com.py/images/thumbs/0201018_500.jpeg,17/6/24
Terere/Mate,SUPERUTIL BOMBILLA ALPACA TORCIDA PUNTA DORADA,Gs   39.300,https://www.stock.com.py/images/thumbs/0200128_500.jpeg,17/6/24
Terere/Mate,SUPERUTIL BOMBILLA DE ALPACA TORCIDA PUNTA DORADA,Gs   39.300,https://www.stock.com.py/images/thumbs/0200127_500.jpeg,17/6/24
Terere/Mate,SUPERUTIL BOMBILLA DE ALPACA TORCIDA PICO LARGO DORADO,Gs   39.300,https://www.stock.com.py/images/thumbs/0200126_500.jpeg,17/6/24
Terere/Mate,SUPERUTIL BOMBILLA DE ALPACA TORCIDA,Gs   37.700,https://www.stock.com.py/images/thumbs/0200124_500.jpeg,17/6/24
Terere/Mate,SUPERUTIL BOMBILLA DE ALPACA TORCIDA PICO LARGO,Gs   37.700,https://www.stock.com.py/images/thumbs/0200123_500.jpeg,17/6/24
Terere/Mate,SUPERUTIL BOMBILLA DE ALPACA PICO LARGO,Gs   37.700,https://www.stock.com.py/images/thumbs/0200122_500.jpeg,17/6/24
Terere/Mate,SUPERUTIL GUAMPA DE CUERINA GRANDE PARA MATE,Gs   22.100,https://www.stock.com.py/images/thumbs/0198130_500.jpeg,17/6/24
Terere/Mate,SUPERUTIL GUAMPA DE CUERO REVESTIDO PARA TERERE,Gs   34.800,https://www.stock.com.py/images/thumbs/0198126_500.jpeg,17/6/24
Terere/Mate,SUPERUTIL GUAMPA DE CUERO CON RELIEVE PARA TERERE,Gs   37.900,https://www.stock.com.py/images/thumbs/0198125_500.jpeg,17/6/24
Terere/Mate,SUPERUTIL GUAMPA DE CUERINA PARA TERERE,Gs   22.100,https://www.stock.com.py/images/thumbs/0198124_500.jpeg,17/6/24
Terere/Mate,SUPERUTIL GUAMPINKI DE CUERO ESTAMPADO PARA MATE,Gs   34.800,https://www.stock.com.py/images/thumbs/0198123_500.jpeg,17/6/24
Terere/Mate,SUPERUTIL GUAMPINKI DE CUERO PARA MATE,Gs   31.600,https://www.stock.com.py/images/thumbs/0198122_500.jpeg,17/6/24
Terere/Mate,SUPERUTIL GUAMPA DE CUERO ESTAMPADO CHICO PARA MATE,Gs   34.800,https://www.stock.com.py/images/thumbs/0198120_500.jpeg,17/6/24
Terere/Mate,SUPERUTIL GUAMPA DE CUERO ESTAMPADO PARA MATE,Gs   37.900,https://www.stock.com.py/images/thumbs/0198119_500.jpeg,17/6/24
Terere/Mate,SUPERUTIL GUAMPA DE CUERO REPUJADO PARA TERERE,Gs   34.800,https://www.stock.com.py/images/thumbs/0198118_500.jpeg,17/6/24
Terere/Mate,SUPERUTIL PORONGO DE CUERINA PARA MATE,Gs   22.100,https://www.stock.com.py/images/thumbs/0198117_500.jpeg,17/6/24
Terere/Mate,SUPERUTIL GUAMPINKI DE CUERINA PARA MATE,Gs   19.000,https://www.stock.com.py/images/thumbs/0198116_500.jpeg,17/6/24
Terere/Mate,SUPERUTIL GUAMPA DE CUERINA CHICO PARA MATE,Gs   19.000,https://www.stock.com.py/images/thumbs/0198115_500.jpeg,17/6/24
Terere/Mate,INDIO HOPPY PARA TERERE PERSONAL DE ACERO INOXIDABLE 450 ML,Gs   99.900,https://www.stock.com.py/images/thumbs/0197149_500.jpeg,17/6/24
Terere/Mate,INDIO KIT TERERE 1 GUAMPA DE ACERO INOXIDABLE + 1 BOMBILLA,Gs   109.900,https://www.stock.com.py/images/thumbs/0197144_500.jpeg,17/6/24
Terere/Mate,INDIO KIT MATE 1 GUAMPA PALO SANTO + 1 BOMBILLA,Gs   99.900,https://www.stock.com.py/images/thumbs/0197142_500.jpeg,17/6/24
Terere/Mate,INDIO TERMO PARA TERERE 2 LITROS + 1 GUAMPA,Gs   249.900,https://www.stock.com.py/images/thumbs/0197139_500.jpeg,17/6/24
Terere/Mate,INDIO TERMO ACERO INOXIDABLE + 1 GUAMPA,Gs   249.900,https://www.stock.com.py/images/thumbs/0197136_500.jpeg,17/6/24
Terere/Mate,"INDIO TERMO DE ACERO INOXIDABLE DOBLE PARED 2,5 LITROS + 1 GUAMPA + 1 BOMBILLA",Gs   379.900,https://www.stock.com.py/images/thumbs/0197132_500.jpeg,17/6/24
Terere/Mate,TERMO P/AGUA FRIA TERMOLAR 2.5L GRIS,Gs   61.500,https://www.stock.com.py/images/thumbs/0193026_500.jpeg,17/6/24
Cocina,LICUADORA DE VASO 500W BS 4707 UFESA,Gs   296.900,https://www.stock.com.py/images/thumbs/0202895_500.jpeg,17/6/24
Cocina,CAFETERA DE GOTEO UFESA CG 7123,Gs   282.500,https://www.stock.com.py/images/thumbs/0202894_500.jpeg,17/6/24
Cocina,LICUADORA PERSONAL BS1500 UFESA,Gs   316.900,https://www.stock.com.py/images/thumbs/0202893_500.jpeg,17/6/24
Cocina,SANDWICHERA SW UFESA 7850,Gs   214.900,https://www.stock.com.py/images/thumbs/0202892_500.jpeg,17/6/24
Cocina,CAFETERA AUT DOLCE G MAQ.MOULINEX NEF M                x 1,Gs   1.330.000,https://www.stock.com.py/images/thumbs/0197934_500.jpeg,17/6/24
Cocina,UFESA EXPRIMIDOR EX4934,Gs   161.450,https://www.stock.com.py/images/thumbs/0197541_500.jpeg,17/6/24
Cocina,UFESA HERVIDOR DE AGUA HA7910,Gs   402.900,https://www.stock.com.py/images/thumbs/0197537_500.jpeg,17/6/24
Cocina,UFESA SANDWICHERA SW7400,Gs   437.150,https://www.stock.com.py/images/thumbs/0197536_500.jpeg,17/6/24
Cocina,MICROONDAS DIGITAL 28LT DAYO ,Gs   979.900,https://www.stock.com.py/images/thumbs/0195633_500.jpeg,17/6/24
Cocina,BATIDORA MANUAL DAYO S/E REF HB02,Gs   104.900,https://www.stock.com.py/images/thumbs/0188482_500.jpeg,17/6/24
Cocina,MAQUINA PARA HACER PAN DAYO ,Gs   599.900,https://www.stock.com.py/images/thumbs/0186890_500.jpeg,17/6/24
Cocina,"HERVIDORA ELECTRICA CELESTE DAYO 1,8LITROS",Gs   99.900,https://www.stock.com.py/images/thumbs/0186889_500.jpeg,17/6/24
Cocina,"HERVIDORA ELECTRICA ROSA DAYO 1,8LITROS",Gs   99.900,https://www.stock.com.py/images/thumbs/0186888_500.jpeg,17/6/24
Cocina,CAFETERA ELECTRICA DOBLE DAYO ,Gs   119.900,https://www.stock.com.py/images/thumbs/0186881_500.jpeg,17/6/24
Cocina,"LICUADORA ELECTRICA DE 1,5 LITROS DAYO",Gs   159.900,https://www.stock.com.py/images/thumbs/0186872_500.jpeg,17/6/24
Cocina,BATIDORA MANUAL C/BOWL DAYO 1529WB,Gs   149.900,https://www.stock.com.py/images/thumbs/0186299_500.png,17/6/24
Cocina,HERVIDORA ELE. 1.8 LTS D/ACERO DAYO REF SM SS180,Gs   53.300,https://www.stock.com.py/images/thumbs/0186293_500.png,17/6/24
Galletitas/Postres,ALFAJOR DE ARROZ RELL/D/LIM LULEMUU 22GR,Gs   5.900,https://www.stock.com.py/images/thumbs/0207976_500.jpeg,17/6/24
Galletitas/Postres,ALFAJOR DE ARROZ DUL/D/LEC LULEMUU 15GR,Gs   5.900,https://www.stock.com.py/images/thumbs/0207975_500.jpeg,17/6/24
Galletitas/Postres,ALFAJOR DE ARROZ DULCE/LEC LULEMUU 22GR,Gs   5.900,https://www.stock.com.py/images/thumbs/0207973_500.jpeg,17/6/24
Galletitas/Postres,PREMEZCLA 3 HARINAS MANDI'O 800GR,Gs   15.000,https://www.stock.com.py/images/thumbs/0207559_500.jpeg,17/6/24
Galletitas/Postres,PREMEZCLA 3HARINAS MANDI'O 800GR,Gs   16.500,https://www.stock.com.py/images/thumbs/0207558_500.jpeg,17/6/24
Galletitas/Postres,POLVO P/BIZCOCH D/VAINILLA MANDI'O 500GR,Gs   21.000,https://www.stock.com.py/images/thumbs/0207539_500.jpeg,17/6/24
Galletitas/Postres,SCHAR GNOCHI ?OQUIS DE PAPAS 300 GR,Gs   40.500,https://www.stock.com.py/images/thumbs/0204681_500.jpeg,17/6/24
Galletitas/Postres,SCHAR BUDIN DE NARANJA SIN GLUTEN 200 GR,Gs   29.500,https://www.stock.com.py/images/thumbs/0204675_500.jpeg,17/6/24
Galletitas/Postres,SCHAR BUDIN DE CHOCOLATE SIN GLUTEN 200 GR,Gs   29.500,https://www.stock.com.py/images/thumbs/0204674_500.jpeg,17/6/24
Galletitas/Postres,SCHAR PAN BLANCO SIN GLUTEN 200 GR,Gs   28.000,https://www.stock.com.py/images/thumbs/0204673_500.jpeg,17/6/24
Galletitas/Postres,MAZZEI CEREAL AROS FRUTALES LIBRE DE GLUTEN 230 GR,Gs   15.500,https://www.stock.com.py/images/thumbs/0204590_500.jpeg,17/6/24
Galletitas/Postres,MAZZEI CEREAL HOJUELAS LIBRE DE GLUTEN 300 GR,Gs   16.000,https://www.stock.com.py/images/thumbs/0204589_500.jpeg,17/6/24
Galletitas/Postres,LESTELLO GALLETAS DE QUINOA CUBIERTO CON CHOCOLATE AMARGO Y CEREZA LIOFILIZADA 36 GR,Gs   22.000,https://www.stock.com.py/images/thumbs/0203287_500.jpeg,17/6/24
Galletitas/Postres,LESTELLO GALLETAS DE QUINOA 130  GR,Gs   26.000,https://www.stock.com.py/images/thumbs/0203286_500.jpeg,17/6/24
Galletitas/Postres,LESTELLO GALLETAS DE GARBANZO CUBIERTA CON CHOCOLATE AMARGO 34 GR,Gs   22.000,https://www.stock.com.py/images/thumbs/0203285_500.jpeg,17/6/24
Galletitas/Postres,LESTELLO GALLETA A BASE DE ARROZ INTEGRAL SORGO ARROZ ROJO AMARANTO CA?AMO CHIA Y QUINOA 65 GR,Gs   22.000,https://www.stock.com.py/images/thumbs/0203284_500.jpeg,17/6/24
Galletitas/Postres,LESTELLO GALLETAS DE TRIGO SARRACENO 135 GR,Gs   26.000,https://www.stock.com.py/images/thumbs/0203283_500.jpeg,17/6/24
Galletitas/Postres,LESTELLO MIJO INFLADO 100 GR,Gs   22.000,https://www.stock.com.py/images/thumbs/0203282_500.jpeg,17/6/24
Galletitas/Postres,LESTELLO TRIGO INFLADO 100 GR,Gs   22.000,https://www.stock.com.py/images/thumbs/0203281_500.jpeg,17/6/24
Galletitas/Postres,PREMEZCLA P/ELAB PANIFICADOS MANDIO 500G,Gs   24.100,https://www.stock.com.py/images/thumbs/0202636_500.jpeg,17/6/24
Galletitas/Postres,OBLEA D/ARROZ C/RELLENO D/LIMON LULEMUU 15GR PLAST,Gs   4.500,https://www.stock.com.py/images/thumbs/0202471_500.jpeg,17/6/24
Galletitas/Postres,ALFAJOR D/ARROZ RELL C/DULCE D/LECHE LULEMUU 17GR PLAST,Gs   5.900,https://www.stock.com.py/images/thumbs/0202470_500.jpeg,17/6/24
Galletitas/Postres,AMADDA PAN RALLADO 500 GR,Gs   42.000,https://www.stock.com.py/images/thumbs/0201119_500.jpeg,17/6/24
Galletitas/Postres,DELUXE GALLETITAS DE ARROZ BA?ADAS CON YOGURT DE FRUTILLA 115 GR,Gs   17.550,https://www.stock.com.py/images/thumbs/0201113_500.jpeg,17/6/24
Galletitas/Postres,GULLON FINAS GALLETA AVENA CON COBERTURA CHOCO LECHE ZERO 150 GR,Gs   25.900,https://www.stock.com.py/images/thumbs/0200897_500.jpeg,17/6/24
Galletitas/Postres,GULLON GALLETA CON CREMA SABOR CHOCOLATE 225 GR,Gs   25.900,https://www.stock.com.py/images/thumbs/0200896_500.jpeg,17/6/24
Galletitas/Postres,GULLON GALLETA CON CHIPS DE CHOCOLATE Y COPOS DE AVENA 220 GR,Gs   25.900,https://www.stock.com.py/images/thumbs/0200895_500.jpeg,17/6/24
Galletitas/Postres,QUALICOCO SALSA TIPO SHOYU DE COCO LIGHT 250 ML,Gs   33.250,https://www.stock.com.py/images/thumbs/0200766_500.jpeg,17/6/24
Ron/Cachasa/Caña,RON ORGANICO FORTIN GUARANI  700 ML,Gs   260.000,https://www.stock.com.py/images/thumbs/0208204_500.jpeg,17/6/24
Ron/Cachasa/Caña,RON ULTRA LITE 4YO FLOR DE CAÑA 1 LITRO,Gs   50.000,https://www.stock.com.py/images/thumbs/0207536_500.png,17/6/24
Ron/Cachasa/Caña,CAN?A TRES LEONES COLECCION PRIVADA 700ML,Gs   314.800,https://www.stock.com.py/images/thumbs/0207024_500.jpeg,17/6/24
Ron/Cachasa/Caña,AGUARDIENTE JAMEL FCO 1000 ML,Gs   25.800,https://www.stock.com.py/images/thumbs/0206889_500.jpeg,17/6/24
Ron/Cachasa/Caña,CAPTAIN MORGAN ORIGINAL SPICED GOLD 750 ML,Gs   64.800,https://www.stock.com.py/images/thumbs/0203279_500.jpeg,17/6/24
Ron/Cachasa/Caña,TRES LEONES RON ORIGINAL COCTEL SABOR COCO 420 ML,Gs   14.500,https://www.stock.com.py/images/thumbs/0201570_500.jpeg,17/6/24
Ron/Cachasa/Caña,TRES LEONES RON ORIGINAL COCTEL SABOR LIMON 420 ML,Gs   14.500,https://www.stock.com.py/images/thumbs/0201569_500.jpeg,17/6/24
Ron/Cachasa/Caña,RON EDICION ESPECIAL 720ML TRES LEONES BOT,Gs   35.100,https://www.stock.com.py/images/thumbs/0201567_500.jpeg,17/6/24
Ron/Cachasa/Caña,RON BLANCO 750ML TRES LEONES BOT,Gs   19.000,https://www.stock.com.py/images/thumbs/0201566_500.jpeg,17/6/24
Ron/Cachasa/Caña,CAÑA TRES LEONES BOTELLA 920 CC,Gs   8.000,https://www.stock.com.py/images/thumbs/0201563_500.jpeg,17/6/24
Ron/Cachasa/Caña,CAÑA TRES LEONES BOTELLA 450 CC,Gs   4.550,https://www.stock.com.py/images/thumbs/0201562_500.jpeg,17/6/24
Ron/Cachasa/Caña,CAÑA ESPECIAL 190 ML TRES LEONES BOT,Gs   2.400,https://www.stock.com.py/images/thumbs/0201555_500.jpeg,17/6/24
Ron/Cachasa/Caña,CAÑA TRES LEONES BOTELLA 750 CC,Gs   18.750,https://www.stock.com.py/images/thumbs/0201554_500.jpeg,17/6/24
Ron/Cachasa/Caña,CAÑA TRES LEONES PET 450 CC,Gs   15.000,https://www.stock.com.py/images/thumbs/0201553_500.jpeg,17/6/24
Ron/Cachasa/Caña,CAÑA TRES LEONES CAJA,Gs   51.400,https://www.stock.com.py/images/thumbs/0201552_500.jpeg,17/6/24
Ron/Cachasa/Caña,TRES LEONES ETIQUETA NEGRA CA?A A?EJADA 8 A?OS 750 ML,Gs   36.550,https://www.stock.com.py/images/thumbs/0201549_500.jpeg,17/6/24
Ron/Cachasa/Caña,RON SABOR CANELA FORTIN 750ML,Gs   18.700,https://www.stock.com.py/images/thumbs/0201544_500.jpeg,17/6/24
Ron/Cachasa/Caña,RON SUAVE ETIQUETA NEGRA EDICION ESPECIAL FORTIN 750ML,Gs   38.000,https://www.stock.com.py/images/thumbs/0201543_500.png,17/6/24
Ron/Cachasa/Caña,CAÑA ETIQUETA NEGRA FORTIN 750ML,Gs   14.550,https://www.stock.com.py/images/thumbs/0201541_500.jpeg,17/6/24
Ron/Cachasa/Caña,CAÑA AÑEJADA FORTIN  450CC,Gs   4.500,https://www.stock.com.py/images/thumbs/0199102_500.jpeg,17/6/24
Ron/Cachasa/Caña,CAÑA AÑEJADA ESPECIAL FORTIN 200ML,Gs   2.450,https://www.stock.com.py/images/thumbs/0198528_500.jpeg,17/6/24
Ron/Cachasa/Caña,CAÑA AÑEJADA ESPECIAL FORTIN 930ML,Gs   7.850,https://www.stock.com.py/images/thumbs/0198527_500.jpeg,17/6/24
Ron/Cachasa/Caña,RON SABOR FRUTOS ROJOS FORTIN 750ML,Gs   18.700,https://www.stock.com.py/images/thumbs/0198526_500.jpeg,17/6/24
Ron/Cachasa/Caña,RON SABOR COCO FORTIN 750ML,Gs   18.700,https://www.stock.com.py/images/thumbs/0198514_500.jpeg,17/6/24
Ron/Cachasa/Caña,RON BLANCO FORTIN 750ML,Gs   18.700,https://www.stock.com.py/images/thumbs/0198513_500.jpeg,17/6/24
Ron/Cachasa/Caña,CACHAZA LIMON 910ML VELHO BARREIRO BOT,Gs   39.550,https://www.stock.com.py/images/thumbs/0193617_500.jpeg,17/6/24
Ron/Cachasa/Caña,HEROICA RON AÑEJADO EN CUBAS FORTIN D/ROBLE 700ML BOT,Gs   200.000,https://www.stock.com.py/images/thumbs/0192094_500.jpeg,17/6/24
Ron/Cachasa/Caña,RON 750 ML FORTIN BOT EDICION ESPECIAL ,Gs   33.000,https://www.stock.com.py/images/thumbs/0192092_500.jpeg,17/6/24
Pre-Pizza,PREPIZZA STOCK 220GR PV,Gs   2.450,https://www.stock.com.py/images/thumbs/0207168_500.jpeg,17/6/24
Pre-Pizza,PRE-PIZZA BLANCA GOURMET EL GERMANO 120GR,Gs   7.600,https://www.stock.com.py/images/thumbs/0187191_500.jpeg,17/6/24
Pre-Pizza,PIZZETAS MY FRIEND X 4UN ,Gs   5.400,https://www.stock.com.py/images/thumbs/0178004_500.jpeg,17/6/24
Pre-Pizza,PRE PIZZA INTEGRAL MY FRIEND B,Gs   6.400,https://www.stock.com.py/images/thumbs/0178003_500.jpeg,17/6/24
Pre-Pizza,PRE PIZZA MY FRIEND 1 UN B,Gs   6.400,https://www.stock.com.py/images/thumbs/0178001_500.jpeg,17/6/24
Pre-Pizza,PRE PIZZA TRADICIONAL 200GR PANTODOS BSA,Gs   6.900,https://www.stock.com.py/images/thumbs/0172312_500.png,17/6/24
Pastas Con Relleno,RAVIOLES DE CARNE HILDEBRAND 500 GR,Gs   28.500,https://www.stock.com.py/images/thumbs/0206934_500.jpeg,17/6/24
Pastas Con Relleno,RAVIOLES DE POLLO HILDEBRAND 500 GR,Gs   25.350,https://www.stock.com.py/images/thumbs/0206933_500.jpeg,17/6/24
Pastas Con Relleno,RAVIOLES RICOTTA LA SALTEÑA 450GR,Gs   39.500,https://www.stock.com.py/images/thumbs/0196626_500.jpeg,17/6/24
Pastas Con Relleno,RAVIOLES DE ESPINACA Y RICOTTA QUIERO MAS 500GR,Gs   29.700,https://www.stock.com.py/images/thumbs/0191935_500.jpeg,17/6/24
Pastas Con Relleno,RAVIOLES DE POLLO QUIERO MAS 500GR,Gs   29.700,https://www.stock.com.py/images/thumbs/0191934_500.jpeg,17/6/24
Pastas Con Relleno,RAVIOLES DE CARNE QUIERO MAS 500GR,Gs   29.700,https://www.stock.com.py/images/thumbs/0191933_500.jpeg,17/6/24
Pastas Con Relleno,ÑOQUIS RELLENOS CON ESPINACA Y RICOTTA QUIERO MAS 500GR,Gs   15.200,https://www.stock.com.py/images/thumbs/0191932_500.jpeg,17/6/24
Pastas Con Relleno,ÑOQUIS RELLENOS CON PANCETA AHUMADA Y CEBOLLA CARAMELIZADA QUIERO MAS 500GR,Gs   15.200,https://www.stock.com.py/images/thumbs/0191931_500.jpeg,17/6/24
Pastas Con Relleno,LA SALTE?A RAVIOLES DE ESPINACA Y QUESO 450 GR,Gs   39.500,https://www.stock.com.py/images/thumbs/0190896_500.jpeg,17/6/24
Pastas Con Relleno,LA SALTE?A RAVIOLES DE CARNE Y VERDURAS 450 GR,Gs   39.500,https://www.stock.com.py/images/thumbs/0190895_500.jpeg,17/6/24
Pastas Con Relleno,LA SALTE?A RAVIOLES DE JAMON Y QUESO 450 GR,Gs   39.500,https://www.stock.com.py/images/thumbs/0190894_500.jpeg,17/6/24
Pastas Con Relleno,LA SALTE?A RAVIOLES DE POLLO Y VERDURA 450 GR,Gs   39.500,https://www.stock.com.py/images/thumbs/0190893_500.jpeg,17/6/24
Pastas Con Relleno,RAVIOLES CUATRO QUESO BETTINI 500GR,Gs   26.000,https://www.stock.com.py/images/thumbs/0187207_500.jpeg,17/6/24
Pastas Con Relleno,"RAVIOLES DE POLLO, CARNE Y ESPINACA BETTINI 1KG",Gs   44.200,https://www.stock.com.py/images/thumbs/0187205_500.jpeg,17/6/24
Pastas Con Relleno,RAVIOLES CUATRO QUESO BETTINI 1KG,Gs   44.200,https://www.stock.com.py/images/thumbs/0187203_500.jpeg,17/6/24
Pastas Con Relleno,RAVIOLES DE CARNE CON VERDURAS BETTINI 1KG,Gs   44.200,https://www.stock.com.py/images/thumbs/0187202_500.jpeg,17/6/24
Pastas Con Relleno,RAVIOLES DE JAMON Y QUESO,Gs   31.100,https://www.stock.com.py/images/thumbs/0151039_500.jpeg,17/6/24
Pastas Con Relleno,RAVIOLES EDWARD CAJA 500 GR DE,Gs   31.200,https://www.stock.com.py/images/thumbs/0151033_500.jpeg,17/6/24
Pastas Con Relleno,RAVIOLITOS LA SALTEÑA 4QUESOS PAQUETE 250GR,Gs   19.300,https://www.stock.com.py/images/thumbs/0143575_500.jpeg,17/6/24
Pastas Con Relleno,RAVIOLES STOCK X 500 GR CARNE,Gs   24.500,https://www.stock.com.py/images/thumbs/0138451_500.jpeg,17/6/24
Pastas Con Relleno,RAVIOLES STOCK DE VERDURAS X 500GR,Gs   24.500,https://www.stock.com.py/images/thumbs/0138450_500.jpeg,17/6/24
Pastas Con Relleno,RAVIOLES STOCK X 500 GR RICOT,Gs   24.500,https://www.stock.com.py/images/thumbs/0138449_500.jpeg,17/6/24
Pastas Con Relleno,RAVIOLES BIANCA X 500 GR POLLO,Gs   24.500,https://www.stock.com.py/images/thumbs/0138448_500.jpeg,17/6/24
Vodka,GIN TONIC DR. LEMON 473 ML,Gs   8.000,https://www.stock.com.py/images/thumbs/0208254_500.jpeg,17/6/24
Vodka,GIN BLOOD ORANGE BEEFEATER LONDON 700 ML,Gs   121.000,https://www.stock.com.py/images/thumbs/0208171_500.jpeg,17/6/24
Vodka,GIN BRIGHTON LONDON DRY 700 ML,Gs   42.500,https://www.stock.com.py/images/thumbs/0208168_500.jpeg,17/6/24
Vodka,GIN HENDRICK'S FLORA ADORA 700 ML,Gs   270.000,https://www.stock.com.py/images/thumbs/0207963_500.jpeg,17/6/24
Vodka,VODKA ELYX ABSOLUT 750ML,Gs   210.000,https://www.stock.com.py/images/thumbs/0207051_500.jpeg,17/6/24
Vodka,GIN 750ML TANQUERAY BOT PACK/COPA DE REGALO,Gs   130.000,https://www.stock.com.py/images/thumbs/0205309_500.jpeg,17/6/24
Vodka,CONTINI ICE VODKA + KIWI 275 ML,Gs   6.500,https://www.stock.com.py/images/thumbs/0204024_500.jpeg,17/6/24
Vodka,CONTINI ICE VODKA + FRUTOS ROJOS 275 ML,Gs   6.500,https://www.stock.com.py/images/thumbs/0204023_500.jpeg,17/6/24
Vodka,CONTINI ICE VODKA + ACAI 275 ML,Gs   6.500,https://www.stock.com.py/images/thumbs/0204022_500.jpeg,17/6/24
Vodka,CONTINI ICE VODKA + LIMON ORIGINAL 275 ML,Gs   6.500,https://www.stock.com.py/images/thumbs/0204021_500.jpeg,17/6/24
Vodka,JOSE CUERVO ESPECIAL TEQUILA REPOSADO 38% ALC. VOL.  750 ML,Gs   105.000,https://www.stock.com.py/images/thumbs/0203374_500.jpeg,17/6/24
Vodka,GIN ORIGINAL WHITLEY NEILL 700ML,Gs   200.000,https://www.stock.com.py/images/thumbs/0202934_500.jpeg,17/6/24
Vodka,GIN LONDON STRAWBERRY 700ML CON COPA,Gs   121.000,https://www.stock.com.py/images/thumbs/0202930_500.jpeg,17/6/24
Vodka,VODKA BOLS 700ML BOT,Gs   56.250,https://www.stock.com.py/images/thumbs/0201490_500.png,17/6/24
Vodka,GIN HENKES 700 ML,Gs   84.750,https://www.stock.com.py/images/thumbs/0201489_500.jpeg,17/6/24
Vodka,GORDON-S THE ORIGINAL LONDON DRY GIN 750 ML,Gs   41.000,https://www.stock.com.py/images/thumbs/0201476_500.png,17/6/24
Vodka,GORDON-S SICILIAN LEMON DISTILLED GIN 700 ML,Gs   64.800,https://www.stock.com.py/images/thumbs/0201475_500.png,17/6/24
Vodka,MIKE-S HARD LEMONADE BEBIDA ALCOHOLICA 269 ML,Gs   5.000,https://www.stock.com.py/images/thumbs/0200817_500.jpeg,17/6/24
Vodka,VODKA BLUE ABSOLUT 750ML,Gs   119.000,https://www.stock.com.py/images/thumbs/0198676_500.jpeg,17/6/24
Vodka,VODKA VAINILLA ABSOLUT 750ML,Gs   108.000,https://www.stock.com.py/images/thumbs/0198675_500.jpeg,17/6/24
Vodka,GIN PREMIUM BLACK 700ML PUERTO DE INDIAS,Gs   184.350,https://www.stock.com.py/images/thumbs/0197554_500.jpeg,17/6/24
Vodka,CITY OF LONDON GIN LEMON 700 ML,Gs   110.000,https://www.stock.com.py/images/thumbs/0196371_500.jpeg,17/6/24
Vodka,GIN ORGANIC WILD BOTANICALS BERTONI 700ML,Gs   160.000,https://www.stock.com.py/images/thumbs/0196054_500.jpeg,17/6/24
Vodka,GIN 700 ML CLASICO CELESTE PUERTO DE INDIAS BOT,Gs   134.500,https://www.stock.com.py/images/thumbs/0194553_500.jpeg,17/6/24
Vodka,GIN 700 ML STRAWBERRY PUERTO DE INDIAS BOT,Gs   173.900,https://www.stock.com.py/images/thumbs/0194552_500.jpeg,17/6/24
Vodka,GIN MG LONDON DRY 700ML,Gs   56.000,https://www.stock.com.py/images/thumbs/0194399_500.jpeg,17/6/24
Vodka,ROCK-S GIN DOCE STRAWBERRY 995 ML,Gs   44.000,https://www.stock.com.py/images/thumbs/0193588_500.jpeg,17/6/24
Vodka,DUROYALE GIN TONICA 275 ML,Gs   6.300,https://www.stock.com.py/images/thumbs/0193524_500.jpeg,17/6/24
Paté/Picadillo/Conservas,PATE DE JAMON ODERICH 100 GR,Gs   5.900,https://www.stock.com.py/images/thumbs/0204652_500.jpeg,17/6/24
Paté/Picadillo/Conservas, CARNE BOVINA ENLATADA BON GUSTO 340GR,Gs   17.050,https://www.stock.com.py/images/thumbs/0202594_500.jpeg,17/6/24
Paté/Picadillo/Conservas,CARNE VACUNA CONSERVADA NORTE 340GR,Gs   17.000,https://www.stock.com.py/images/thumbs/0197888_500.jpeg,17/6/24
Paté/Picadillo/Conservas,PATE DE CARNE ODERICH 100GR,Gs   5.900,https://www.stock.com.py/images/thumbs/0168958_500.jpeg,17/6/24
Paté/Picadillo/Conservas,CARNE CONSERV.CALF 340GR ,Gs   15.400,https://www.stock.com.py/images/thumbs/0162948_500.jpeg,17/6/24
Paté/Picadillo/Conservas,CARNE BOVINA ODERICH,Gs   17.250,https://www.stock.com.py/images/thumbs/0155368_500.jpeg,17/6/24
Paté/Picadillo/Conservas,PATE ODERICH LATA 100 GR POLLO,Gs   5.900,https://www.stock.com.py/images/thumbs/0155365_500.jpeg,17/6/24
Paté/Picadillo/Conservas,PICADILLO INDEGA,Gs   3.400,https://www.stock.com.py/images/thumbs/0149591_500.jpeg,17/6/24
Paté/Picadillo/Conservas,CARNE CONSERVADA INDEGA 340,Gs   18.650,https://www.stock.com.py/images/thumbs/0149557_500.jpeg,17/6/24
Paté/Picadillo/Conservas,PICADILLO DE CARNE SAFRA LATA 90 GR,Gs   3.750,https://www.stock.com.py/images/thumbs/0144364_500.jpeg,17/6/24
Tratamientos,TRATAMIENTO CAPILAR REPARACION Y COLOR CAREY 245GR,Gs   13.650,https://www.stock.com.py/images/thumbs/0208427_500.jpeg,17/6/24
Tratamientos,TRATAMIENTO CAPILAR RECONSTRUCCION TOTAL CAREY 245GR,Gs   13.650,https://www.stock.com.py/images/thumbs/0208426_500.jpeg,17/6/24
Tratamientos,TRATAMIENTO CAPILAR RENUTRICION DIARIA CAREY 245GR,Gs   13.650,https://www.stock.com.py/images/thumbs/0208425_500.jpeg,17/6/24
Tratamientos,MASCARA CAP/REP/REC/CAREY NUTRILEA 245GR,Gs   13.350,https://www.stock.com.py/images/thumbs/0208418_500.jpeg,17/6/24
Tratamientos,MASCARA CAP/PROT/COL/CAREY NUTRILEA 245G,Gs   13.350,https://www.stock.com.py/images/thumbs/0208417_500.jpeg,17/6/24
Tratamientos,CREMA P/PEINAR LISOS NUTRILEA CAREY 300G,Gs   24.000,https://www.stock.com.py/images/thumbs/0208416_500.jpeg,17/6/24
Tratamientos,CREMA P/PEINAR RULOS CAREY NUTRILEA 300G,Gs   24.000,https://www.stock.com.py/images/thumbs/0208415_500.jpeg,17/6/24
Tratamientos,CREMA P/PEINAR ANTIQUIEBR L'OREAL  300ML,Gs   43.900,https://www.stock.com.py/images/thumbs/0208258_500.jpeg,17/6/24
Tratamientos,MASCARILLA DE FUERZA L'OREAL CAIDA 300GR,Gs   44.900,https://www.stock.com.py/images/thumbs/0208257_500.jpeg,17/6/24
Tratamientos,HEAD & SHOULDERS PACK SHAMPOO PROTECCION CAIDA CON CAFEINA 375 ML + DERMO-ACONDICIONADOR PROTECCION CAIDA CON CAFEINA 150 ML,Gs   45.500,https://www.stock.com.py/images/thumbs/0207108_500.jpeg,17/6/24
Tratamientos,CASTING CREME GLOSS 300,Gs   62.900,https://www.stock.com.py/images/thumbs/0205069_500.jpeg,17/6/24
Tratamientos,CAPILATIS NATURAL OIL OLEO CAPILAR CON ARGAN 60 ML,Gs   78.550,https://www.stock.com.py/images/thumbs/0204966_500.jpeg,17/6/24
Tratamientos,CAPILATIS NATURAL OIL BALSAMO CON ARGAN 420 ML,Gs   63.900,https://www.stock.com.py/images/thumbs/0204964_500.jpeg,17/6/24
